name,phone,region,postalZip,text,numberrange,currency,country,list,email,name1,company,name2,name4,name3,name5,name6,name7,name8
Jael Fox,1-114-768-9814,Languedoc-Roussillon,52703,"lacus. Quisque imperdiet, erat nonummy ultricies ornare, elit elit fermentum",3,$38.56,South Korea,19,auctor.odio@hotmail.com,Declan Nguyễn,Ipsum Curabitur Consequat Inc.,Samuel O'donnell,Autumn Ellis,Erin Villarreal,Orson Rich,Chester Hall,Bevis Acevedo,Allistair Hutchinson
Kadeem Barr,(850) 880-8362,Nevada,7210,eget nisi dictum augue malesuada malesuada. Integer id magna et,2,$84.28,Germany,15,vitae.erat@hotmail.com,Ray Thi,Quam Limited,Lila Lloyd,Price Mcdowell,Kareem Russell,Chandler Wooten,Fuller Finley,Zane Maldonado,Anastasia Gregory
Odessa Key,1-781-935-6270,South Sulawesi,204774,"interdum. Sed auctor odio a purus. Duis elementum, dui quis",7,$35.35,Ireland,15,urna@google.edu,Thor Nguyễn,Sed Turpis Corp.,Audrey Hayden,Maile Rhodes,Josephine Cote,Noah Dunn,Grace Hutchinson,Branden Hopper,Kelly Ochoa
Judah Sherman,1-626-261-6737,Renfrewshire,63-97,adipiscing elit. Curabitur sed tortor. Integer aliquam adipiscing lacus. Ut,1,$8.70,Brazil,15,nullam.velit@icloud.edu,Desiree Nguyễn,Tempus Mauris Corporation,Camilla Colon,Vera Pacheco,Gisela Davenport,Pamela Guerra,Meghan Byers,Kimberly Landry,Lee Barnett
Keaton Shields,(286) 524-3981,Cagayan Valley,689860,nulla. Cras eu tellus eu augue porttitor interdum. Sed auctor,1,$90.07,Ireland,1,in.sodales@outlook.ca,Tate Nguyễn,Eu Tellus Eu Institute,Whilemina Maynard,Aline Galloway,Sydnee Knight,Oprah Deleon,Daquan Fuller,Logan Kramer,Fatima Kelly
Macy Bowman,(917) 687-8715,Møre og Romsdal,7169,"aliquet libero. Integer in magna. Phasellus dolor elit, pellentesque a,",7,$45.57,Austria,7,risus@yahoo.ca,Kiayada Dữu,Laoreet Posuere Enim Consulting,Uta Bauer,Bethany George,Francesca Vega,Baker Hyde,Vincent Swanson,Kamal Franks,Elvis Giles
Kenneth Macdonald,1-714-992-3715,South Gyeongsang,25248,"velit in aliquet lobortis, nisi nibh lacinia orci, consectetuer euismod",1,$11.92,Pakistan,5,non.enim@icloud.edu,Tanner Nguyễn,Aenean Eget LLC,Randall Melton,Hedwig Fuentes,Rigel Savage,Nolan Santiago,Echo Cook,Ciaran Sparks,Kirk Wallace
Sonia Conner,(731) 331-7325,Nghệ An,468624,urna. Nunc quis arcu vel quam dignissim pharetra. Nam ac,9,$8.87,India,15,malesuada.fringilla.est@hotmail.com,Aquila Nguyễn,Lorem Donec Institute,Vance Burris,Len Dorsey,Christian Mullen,Tate George,Hollee Britt,Halla Dyer,Alden Massey
Noah Barr,1-846-414-5403,Trentino-Alto Adige,44360-30098,Curabitur massa. Vestibulum accumsan neque et nunc. Quisque ornare tortor,3,$35.35,Philippines,15,augue.scelerisque.mollis@aol.edu,Lucas Nguyễn,Hendrerit Inc.,Coby Kennedy,Xander Allen,Kane Hill,Wallace Ratliff,Xander Carey,Germane Lucas,Boris Carlson
Lani Harrell,1-348-935-6356,Sinaloa,61-887,"sociis natoque penatibus et magnis dis parturient montes, nascetur ridiculus",7,$78.47,Netherlands,15,urna@hotmail.couk,Baxter Nguyễn,Ante Nunc Consulting,Alexa George,Ahmed Collins,Whilemina Munoz,Ethan Lancaster,Jada Hawkins,Dacey Mckay,Yolanda Lowery
Aline Kirby,(451) 455-7649,Nghệ An,2127-9632,"lobortis, nisi nibh lacinia orci, consectetuer euismod est arcu ac",10,$14.04,United Kingdom,11,curabitur.vel@google.ca,Alexa Nguyễn,Tellus Aenean Corp.,Bertha Hewitt,Heidi Harmon,Vivien Morin,Quynn Pate,Talon King,Amethyst Baker,Giacomo Macias
Camden Evans,(340) 557-1751,Bremen,3128,Proin sed turpis nec mauris blandit mattis. Cras eget nisi,6,$28.48,Brazil,3,est@outlook.com,Bryar Vương,Magna PC,Allistair Vaughan,Shannon Powell,Hayden Hammond,Patricia Hudson,Fuller Morse,Clarke Morse,Kai Wolf
Dorian King,(251) 244-7357,Calabria,GC5Z 1EC,"ac sem ut dolor dapibus gravida. Aliquam tincidunt, nunc ac",8,$49.82,Nigeria,9,luctus@hotmail.ca,Andrew Nguyễn,Arcu PC,Hillary Armstrong,Angelica Mcconnell,Norman Hurst,Courtney Roth,Hamilton Gilmore,Rebecca Henson,Kareem Fleming
Noel Raymond,1-519-847-8778,Daman and Diu,71532,"mi lacinia mattis. Integer eu lacus. Quisque imperdiet, erat nonummy",5,$65.78,Germany,5,ut@outlook.edu,Boris Nguyễn,Semper Et Corp.,Silas Bright,Dieter Humphrey,Brent Blair,Oliver Wright,Hiroko Mcdonald,Lesley Harris,Sara Mack
Timothy Valencia,1-944-807-5932,Nord-Pas-de-Calais,38176,"mi tempor lorem, eget mollis lectus pede et risus. Quisque",1,$65.51,United Kingdom,13,nunc@protonmail.org,Magee Tần,Amet Orci Foundation,Mira Shelton,Allistair Haney,Joel Miranda,Aimee Doyle,Linda Ellison,Phillip Hughes,Nero Stein
Uriel Dunlap,1-600-289-4707,Huádōng,248731,"pellentesque massa lobortis ultrices. Vivamus rhoncus. Donec est. Nunc ullamcorper,",4,$59.79,India,5,magna@google.ca,Shea Nguyễn,A Consulting,Geraldine Pitts,Troy Rivera,Nolan Holmes,Tanek Alvarez,Oprah Griffin,Herman Lindsey,Preston Brooks
Roth Nixon,(691) 338-6901,Imo,71841,"Donec est mauris, rhoncus id, mollis nec, cursus a, enim.",9,$86.17,Indonesia,3,orci@google.com,Sawyer Nguyễn,Eu Institute,Shelly Ortiz,Magee Garcia,Prescott Osborn,Wang Melendez,Todd Bonner,Carly Bernard,Andrew Slater
Sydnee Puckett,(345) 573-1555,Brandenburg,388173,"mollis. Phasellus libero mauris, aliquam eu, accumsan sed, facilisis vitae,",1,$23.74,South Africa,3,semper@aol.couk,Tatyana Nguyễn,Iaculis Lacus Incorporated,Orlando Ayala,Lara Porter,Felicia Fields,Zenaida Bond,Hashim Schroeder,Petra Levine,Katell Ayala
Renee Osborn,1-274-125-2819,Nevada,W1 7EC,Vestibulum ante ipsum primis in faucibus orci luctus et ultrices,6,$17.43,Peru,3,orci.lacus.vestibulum@google.ca,Abigail Thân,Etiam Bibendum Institute,Florence Reilly,Maxine Walton,Acton Casey,Brock Dawson,Aaron Humphrey,Yasir Barlow,Beck Munoz
Jacqueline Nolan,1-467-857-6170,Tiền Giang,41780,Aenean euismod mauris eu elit. Nulla facilisi. Sed neque. Sed,3,$91.07,Australia,15,quam@icloud.couk,Yeo Nguyễn,Mi Aliquam Foundation,Elizabeth Barlow,Nadine Battle,Charity Hendricks,Alexandra Rollins,Heather Blevins,Noelle Aguilar,Michael Ayers
Jordan Sutton,(698) 262-4766,Central Region,8033,"in, hendrerit consectetuer, cursus et, magna. Praesent interdum ligula eu",4,$94.30,Russian Federation,1,ut.sagittis.lobortis@protonmail.edu,Mercedes Nguyễn,Pharetra Corp.,Kyla Moon,Kieran Buck,Daniel Vinson,Zephania Hodge,Nora Barlow,Gemma Carroll,Quemby Sanford
Celeste Walker,1-668-532-7576,Kherson oblast,4724,"pede sagittis augue, eu tempor erat neque non quam. Pellentesque",4,$91.85,United States,15,ullamcorper.nisl.arcu@outlook.couk,Hamish Nguyễn,Laoreet Ipsum Inc.,Gloria Alexander,Nerea Sutton,Donovan Mcdonald,Edward Farley,Adrian Molina,Ivana Bowers,Dana Austin
Emily Fernandez,1-347-667-6227,Zakarpattia oblast,777655,eget metus. In nec orci. Donec nibh. Quisque nonummy ipsum,7,$37.49,Costa Rica,11,tristique.pharetra.quisque@google.com,Xander Ổn,Felis Ullamcorper Corporation,Amanda Schultz,Gabriel Poole,Vance Shelton,Margaret Hicks,Jane Wooten,Noah Knowles,Jerry Acevedo
Phelan Pope,1-428-571-2194,Leinster,83601-55172,"luctus sit amet, faucibus ut, nulla. Cras eu tellus eu",2,$80.67,Russian Federation,3,nunc.ac@hotmail.ca,Hyatt Nguyễn,Amet Ante Ltd,Iliana Richmond,Vanna Hudson,Ora Parker,Elijah Fields,Barrett Ewing,Kylan Gardner,Hector Case
Nolan Gross,1-219-576-6431,Delaware,O1F 4RT,"Nullam scelerisque neque sed sem egestas blandit. Nam nulla magna,",0,$65.23,Brazil,19,cras.sed@protonmail.couk,Dean Từ,Nunc Industries,Sade Morse,Judah Kaufman,Shea Manning,Judith Lynn,Zia Ware,Katelyn Lara,Lance Vinson
Talon Branch,(835) 492-4540,Lampung,6255 YS,"amet, consectetuer adipiscing elit. Curabitur sed tortor. Integer aliquam adipiscing",9,$44.28,India,11,aliquet.molestie.tellus@icloud.ca,Amy Nguyễn,Parturient Montes LLC,Ezra Owens,Brian Davenport,Karly Kline,Cole Castillo,Francesca Wilcox,Tallulah Collier,Mufutau Hudson
Alfreda Wilkins,1-843-705-0638,Maule,FT4 8SO,Phasellus in felis. Nulla tempor augue ac ipsum. Phasellus vitae,10,$6.20,Costa Rica,9,eget@hotmail.couk,Len Nguyễn,Ornare Libero Foundation,Ina Holt,Renee Kaufman,Wesley Forbes,Ila Griffith,Josephine England,Hop Mosley,Kelly Mckenzie
Zelenia Santana,(552) 743-7733,Minas Gerais,58682,senectus et netus et malesuada fames ac turpis egestas. Aliquam,7,$70.60,Netherlands,5,libero.morbi.accumsan@yahoo.net,Josephine Nguyễn,Sapien Gravida Non Corporation,Colin Lambert,Matthew Buckley,Fiona Fisher,Kylee Copeland,Carolyn Tanner,Ursula Miller,Brynn Meadows
Renee Powers,(157) 476-4474,La Libertad,36487-56061,"mi pede, nonummy ut, molestie in, tempus eu, ligula. Aenean",10,$2.29,Germany,17,arcu.ac@google.org,Kylan Nguyễn,A Sollicitudin Ltd,Orson Kaufman,Pandora Steele,India Clay,Hop Warner,Gray Byrd,Nathaniel Parker,Medge Foreman
Alana Mccullough,(627) 339-1645,Aquitaine,8746,nascetur ridiculus mus. Donec dignissim magna a tortor. Nunc commodo,3,$79.51,Canada,5,augue.sed@icloud.com,Mufutau Nguyễn,Semper Auctor LLC,Shad Workman,Cade Morgan,Xantha Hendricks,Lance Moses,Fatima White,Conan Castaneda,Gannon Lawrence
Daphne Benjamin,1-888-899-6700,Rivers,607532,erat vitae risus. Duis a mi fringilla mi lacinia mattis.,0,$89.38,Colombia,9,gravida.aliquam@hotmail.org,Dante Nguyễn,Feugiat Nec Industries,Roth Morgan,Dane Rich,Buckminster Thomas,Karyn Carlson,Zeus Rowland,Mercedes Clarke,Ursa Koch
Amery Osborn,(220) 258-1567,West Region,24132,"vitae, posuere at, velit. Cras lorem lorem, luctus ut, pellentesque",6,$65.75,Chile,15,rutrum@aol.edu,Emi Đường,Dolor Tempus Foundation,Jemima Wiley,Yetta Hines,Gage Guerrero,Aileen Calderon,Clio Burris,Jakeem Garner,Finn Clay
Tanek Gates,1-485-427-4160,Sinaloa,6410,quam a felis ullamcorper viverra. Maecenas iaculis aliquet diam. Sed,1,$36.99,Italy,19,augue.malesuada@protonmail.net,Cedric Nguyễn,Mauris Nulla Ltd,Hyacinth Castro,Kuame Mercado,Nichole Todd,Vernon Chang,Logan Key,Tamekah Vang,Teegan Spears
Carlos Russo,(827) 381-6361,Basse-Normandie,279186,"semper egestas, urna justo faucibus lectus, a sollicitudin orci sem",9,$48.61,South Africa,11,sit.amet.consectetuer@protonmail.ca,Quon Thai,Duis LLP,Raja Morrow,Uriah Ramsey,Ifeoma Maldonado,Angela Ballard,Bell Hobbs,Evan Rojas,Abbot Mann
Gil Webster,(437) 473-4716,Poitou-Charentes,71K 3H6,"lorem, luctus ut, pellentesque eget, dictum placerat, augue. Sed molestie.",7,$77.28,Germany,11,a.nunc@google.net,Jerry Nguyễn,Purus Sapien Inc.,Dieter Nelson,Blaze Robles,Minerva Cervantes,Troy Everett,Faith Mcbride,Asher Love,Shelly Leonard
Ulric Campos,1-691-467-3647,Arica y Parinacota,788723,Aliquam rutrum lorem ac risus. Morbi metus. Vivamus euismod urna.,10,$44.97,Germany,1,ac.mattis@aol.net,Haviva Nguyễn,Primis In PC,Carissa Fox,Ebony Suarez,Aretha Hartman,Quinn Perez,Bevis Bass,Ryder Marks,Anika Rojas
Murphy Melendez,(656) 938-8144,Pays de la Loire,46357,"vitae semper egestas, urna justo faucibus lectus, a sollicitudin orci",8,$91.17,Vietnam,15,duis@icloud.net,Tatum Nguyễn,Et Tristique Company,Elvis Strickland,Giselle Briggs,Zeph Davenport,Quail Briggs,Tobias Sutton,Gwendolyn Compton,Luke Gonzalez
Julie Rutledge,1-804-604-7728,Borno,4248,"Sed diam lorem, auctor quis, tristique ac, eleifend vitae, erat.",8,$33.94,Nigeria,13,sapien.cras.dolor@google.com,Demetrius Nguyễn,Leo Cras Vehicula Associates,Amal Rosario,Meredith Baldwin,Jessamine Brown,Lamar Barrett,Eleanor Reid,Charde Moss,Hector Albert
Rigel Nash,(735) 739-4897,South Island,11214,amet risus. Donec egestas. Aliquam nec enim. Nunc ut erat.,7,$97.14,United States,15,sem.ut.dolor@aol.ca,Elliott Nguyễn,Cras Incorporated,Sacha Stokes,Laura Stevenson,Urielle Chavez,Violet Luna,Jamalia Wynn,Haley Walton,Brenda Bates
Eleanor Tate,(338) 847-5755,Haute-Normandie,54583-522,"eu, accumsan sed, facilisis vitae, orci. Phasellus dapibus quam quis",7,$64.64,Russian Federation,1,amet@aol.edu,Dolan Nguyễn,Arcu Ac Institute,Inga Santana,Jarrod Sharp,Keefe Jefferson,Sylvia Byers,Mariko Nolan,Adria Hurst,Hilel Foster
Aretha Emerson,(403) 755-7180,Angus,58-39,"imperdiet ullamcorper. Duis at lacus. Quisque purus sapien, gravida non,",3,$78.51,Australia,7,nullam.lobortis@icloud.com,Fitzgerald Lữ,Dui Lectus Rutrum Foundation,Stacy Puckett,Harlan Maxwell,Tana Rivas,Dara Strong,Ann Kaufman,Orli Wright,Leroy Espinoza
Nero Gross,1-234-726-7367,East Java,92755,dictum. Proin eget odio. Aliquam vulputate ullamcorper magna. Sed eu,3,$7.53,Ireland,15,eu.nibh@protonmail.ca,Aquila Nguyễn,In Faucibus Morbi PC,Aurora Ramsey,Harrison Christensen,Hamish Hayden,Echo Downs,Yoshi Burch,Elizabeth Hickman,Buffy Solis
Oliver Castillo,1-284-257-6342,North West,384532,In tincidunt congue turpis. In condimentum. Donec at arcu. Vestibulum,4,$19.36,Peru,15,dolor.dapibus@aol.org,Hu Nguyễn,Ullamcorper Velit Associates,Quyn Lancaster,Kirsten Melendez,Troy Richard,Tad Kennedy,Fay Patton,Ulla Swanson,Lael Avery
Astra Hodges,1-833-284-2453,Quebec,3639,nulla at sem molestie sodales. Mauris blandit enim consequat purus.,1,$35.37,Russian Federation,19,metus.eu@icloud.couk,Kylie Nguyễn,Amet PC,Maia Bauer,Quon Gordon,Riley Kerr,Sade Monroe,Zena Hardy,Carolyn Moses,Tanner Burris
Ann Petty,(212) 101-2443,Đồng Nai,981774,"neque tellus, imperdiet non, vestibulum nec, euismod in, dolor. Fusce",8,$25.43,United States,5,nulla.vulputate.dui@yahoo.net,Hilel Nguyễn,Magnis Dis PC,Cullen Alexander,Quinn Wolf,Slade Flynn,Giacomo Carter,Hamilton Dillard,Brenden Gates,Hayley Rutledge
Kathleen Jennings,(716) 241-2828,Sachsen-Anhalt,434413,"placerat, augue. Sed molestie. Sed id risus quis diam luctus",0,$41.60,Russian Federation,13,turpis@icloud.org,Aphrodite Nguyễn,Orci Consectetuer Incorporated,Shad Holman,Vincent Kerr,Amity Reid,Tatum Carver,Felix Rose,Kenyon Gibson,Winifred Andrews
Stephen Walters,(434) 498-0767,Oslo,585064,"tellus sem mollis dui, in sodales elit erat vitae risus.",9,$11.90,Australia,19,velit.eget@outlook.net,Phillip Thảo,Elit Sed Consequat Foundation,Illana Huffman,Robin Pratt,Noelle Flynn,Vera Jimenez,Declan Marshall,Wayne Hopper,Jasper Blanchard
Selma Bradley,1-211-788-6408,Gauteng,20-722,nulla at sem molestie sodales. Mauris blandit enim consequat purus.,4,$21.64,Brazil,13,libero@icloud.org,Victoria Nguyễn,Tristique Corp.,Hiram Bolton,Adria Petty,Daphne Bowman,Hall Schwartz,Teagan O'Neill,Astra Ewing,Louis Wilkinson
Dylan Dickerson,(888) 856-9607,Luxemburg,826532,tincidunt. Donec vitae erat vel pede blandit congue. In scelerisque,4,$67.57,Russian Federation,9,sed.turpis.nec@outlook.org,Mariko Khâu,Eget Laoreet Incorporated,Cora Cote,Scott Bradford,Willa Graham,Emmanuel Cameron,Ross Mathis,Nomlanga Graham,Grady Pacheco
Zenaida Ryan,(482) 182-2953,Querétaro,125796,"ligula tortor, dictum eu, placerat eget, venenatis a, magna. Lorem",8,$6.32,Norway,13,tincidunt@google.couk,Macy Lệ,Enim Gravida Institute,Blaze Combs,Dean Howell,Kiona Sims,Cody Houston,Lillith Justice,Wade Levine,Basia Holder
Morgan Mcmillan,1-369-774-8614,Uttarakhand,4612,"natoque penatibus et magnis dis parturient montes, nascetur ridiculus mus.",3,$91.58,Pakistan,11,mauris@google.edu,Chadwick Nguyễn,Placerat Velit Corp.,Beatrice Erickson,Brock Hopkins,Rae Petersen,Wallace Mcdaniel,Iliana Mercer,Jerry Morton,Rinah Kramer
Colorado Buckley,(743) 647-5431,Oslo,26-59,Etiam gravida molestie arcu. Sed eu nibh vulputate mauris sagittis,10,$90.79,France,9,ante.vivamus@aol.edu,Boris Nguyễn,Aliquam Ultrices Iaculis Institute,Ivor Byers,Demetria Thompson,Abra Stokes,Echo Good,Alvin Snow,Kyle Day,Avram Banks
Kiayada Underwood,(674) 652-6266,Huádōng,69007,"et, eros. Proin ultrices. Duis volutpat nunc sit amet metus.",6,$54.32,Colombia,3,ridiculus.mus@outlook.couk,Britanney Nguyễn,Eget Laoreet Posuere Foundation,Whilemina Rosales,Velma Burns,Sylvia Delacruz,Vanna Mooney,Abdul Ford,Mercedes Hall,Jin Jacobs
Frances Cantrell,(372) 213-2821,Guanacaste,60B 0J4,"at auctor ullamcorper, nisl arcu iaculis enim, sit amet ornare",7,$85.03,Russian Federation,13,consequat.lectus@yahoo.net,Emma Thân,Et Commodo At Institute,Aquila Blake,Yoshio Ray,Cheyenne Pace,Naida Caldwell,Holmes Perkins,Carter Medina,Abbot Washington
Brooke Vazquez,(415) 888-6729,Northern Territory,9821,"lacus. Nulla tincidunt, neque vitae semper egestas, urna justo faucibus",4,$95.08,Mexico,9,non.bibendum.sed@google.edu,Jordan Nguyễn,Quam Elementum At Limited,Angela Mullins,Castor Rutledge,Raymond Guthrie,Ginger Carver,Malik Bean,Harding Koch,Quintessa Lamb
Justin Glenn,1-594-830-0842,Berkshire,744152,tincidunt vehicula risus. Nulla eget metus eu erat semper rutrum.,1,$98.64,Sweden,17,metus.aenean@hotmail.org,Vivian Nguyễn,Bibendum Industries,Ina Ortega,Scott Randolph,Guy Rodriquez,Cameron Hampton,Noelani Smith,Melyssa Matthews,Naida Pacheco
Giacomo Freeman,(686) 465-7731,Himachal Pradesh,667414,"Sed diam lorem, auctor quis, tristique ac, eleifend vitae, erat.",0,$47.21,Sweden,5,enim.consequat@protonmail.ca,Chaney Giang,Natoque Penatibus Et Industries,Jessamine Trujillo,Isadora Sears,Timothy Goff,Doris Tyler,Dolan Daugherty,Warren Nash,Xandra Morin
Hyatt Vaughn,1-206-304-7283,Namen,8535 RY,Mauris eu turpis. Nulla aliquet. Proin velit. Sed malesuada augue,2,$6.13,New Zealand,7,at.velit@icloud.net,Ifeoma Quan,Euismod In Dolor Corp.,Tad Gay,Emmanuel Fields,TaShya Blankenship,Demetrius Brennan,Sydney Craft,Mara Burks,Chiquita Webb
Pearl Coffey,1-675-785-4685,Risaralda,98587-37851,tempor augue ac ipsum. Phasellus vitae mauris sit amet lorem,3,$24.63,Colombia,5,nam.porttitor.scelerisque@outlook.edu,Chester Nguyễn,Vitae Institute,Jackson Haynes,Benedict Ochoa,Autumn Dixon,Nadine Weaver,Alden Hogan,Kiayada Guthrie,Glenna Dorsey
Germaine Sutton,1-834-369-1117,Wyoming,559188,"tempus eu, ligula. Aenean euismod mauris eu elit. Nulla facilisi.",3,$85.56,Nigeria,5,lorem.ipsum@aol.org,Aline Nguyễn,Cursus LLC,Hollee Tate,Bryar Walsh,Rudyard Pickett,Cruz Wiley,Christian Puckett,Irene Kane,Carly Jarvis
Levi Douglas,1-622-123-7355,Haryana,1063,facilisi. Sed neque. Sed eget lacus. Mauris non dui nec,2,$64.46,Brazil,15,viverra@aol.com,Daria Nguyễn,Ipsum Associates,Doris Potts,Ali Jefferson,Arsenio Schultz,Yael Morrison,Austin Kaufman,Merritt Steele,Rhonda Whitney
Dieter Stafford,1-327-204-2184,Brussels Hoofdstedelijk Gewest,702437,"nibh. Phasellus nulla. Integer vulputate, risus a ultricies adipiscing, enim",9,$46.39,Pakistan,5,egestas.ligula@google.com,Reece Nguyễn,Sed Libero Corp.,Heather Bruce,Lucas Knowles,Deborah Stark,Daria Parsons,Jessica Hendricks,Aaron Stokes,Leilani Cannon
Adam Witt,(207) 426-5376,Lagos,862845,"Morbi neque tellus, imperdiet non, vestibulum nec, euismod in, dolor.",9,$91.65,Ukraine,15,dignissim.lacus@yahoo.org,Kenneth Hầu,Lacus Nulla Foundation,David Bradford,Justine Phelps,Lareina Sykes,Amos Gordon,Yetta Bass,Jason Hopkins,Keegan Yang
Jemima Goodman,(943) 421-1846,Western Australia,755543,erat. Etiam vestibulum massa rutrum magna. Cras convallis convallis dolor.,5,$12.33,Indonesia,11,convallis.in@google.com,Dana Nguyễn,Felis Donec Institute,Dorian England,Aphrodite Haney,Owen Horn,Keane Richards,Moana Bryant,Yardley Romero,Matthew Lopez
Grace Chaney,1-661-666-5441,Phú Thọ,64323,"pede. Suspendisse dui. Fusce diam nunc, ullamcorper eu, euismod ac,",4,$3.66,Belgium,3,pellentesque.habitant.morbi@outlook.couk,Juliet Nguyễn,Sem Mollis Dui Limited,Carter Morin,Ivor Sears,Zephania Delgado,Jada Cruz,Ishmael Gilmore,Kuame Harding,Fiona Hoffman
Ashton O'brien,(747) 973-1649,West-Vlaanderen,674736,"Nunc lectus pede, ultrices a, auctor non, feugiat nec, diam.",0,$18.00,Russian Federation,17,orci.consectetuer@protonmail.org,Buffy Nguyễn,Augue Sed LLC,Mara Gregory,Felicia Knox,Irma Carr,Armando Cantu,Roth Byrd,Dorian Silva,Aurora Wallace
Nash Bright,(625) 228-4438,Basilicata,47624-777,a felis ullamcorper viverra. Maecenas iaculis aliquet diam. Sed diam,10,$64.82,Peru,7,sagittis@yahoo.couk,Kylan Ông,Fermentum Risus At Ltd,Kirby Bridges,Ferris Frederick,Bert Weiss,Honorato Paul,Daniel Bruce,Bradley Romero,Prescott Rodriguez
Ainsley Herring,(716) 462-8873,South Island,61469,"libero lacus, varius et, euismod et, commodo at, libero. Morbi",7,$10.65,France,5,pellentesque.a@icloud.com,Priscilla Nguyễn,Libero Donec Consectetuer LLC,Harper Richmond,Lucy Mcdonald,Joshua Mcdaniel,Akeem Webb,Carson Bates,Orson Maynard,Ingrid Riggs
Ronan Case,1-675-558-6776,Minas Gerais,21104,"vel est tempor bibendum. Donec felis orci, adipiscing non, luctus",4,$18.13,Peru,17,dapibus.ligula@icloud.org,Devin Nguyễn,Faucibus Morbi Institute,Tiger Lott,Ria Drake,Deanna Freeman,Alisa Maynard,Ciaran Mullen,Alvin Vinson,Brittany Merritt
Connor May,(712) 801-4626,Zeeland,915137,"ultricies ornare, elit elit fermentum risus, at fringilla purus mauris",0,$14.21,Colombia,15,sagittis.felis.donec@yahoo.edu,Geoffrey Nguyễn,Velit Pellentesque Inc.,Hakeem Alford,Quin Castillo,Coby Love,Charles Maddox,Malik Park,Jeanette Melton,Nicholas Bauer
Stella Massey,(725) 971-5023,West Region,393365,"justo. Proin non massa non ante bibendum ullamcorper. Duis cursus,",9,$54.37,Italy,9,arcu@yahoo.org,Elliott Biện,Lectus Cum Ltd,Rebekah Ware,Gretchen Merritt,David Cruz,Iona Small,Giacomo Walls,Jamal Boone,Germane Schwartz
Penelope Porter,(359) 371-0355,Northern Territory,33225,"mi lacinia mattis. Integer eu lacus. Quisque imperdiet, erat nonummy",4,$7.78,China,3,dolor.tempus.non@hotmail.couk,Buffy Nguyễn,Aliquam Fringilla Cursus LLC,Plato Garner,Rana Gallegos,Kelly Petersen,Stewart Noel,Valentine Cooke,Joseph Sargent,Colby Cameron
Holmes Rivas,1-755-318-3668,Donetsk oblast,3293,placerat velit. Quisque varius. Nam porttitor scelerisque neque. Nullam nisl.,7,$91.04,Brazil,1,massa.vestibulum.accumsan@aol.ca,Hedda Nguyễn,Sed Dui Institute,Cailin Melton,Driscoll Byrd,Yoshio Bass,Lawrence Wagner,Lilah Harvey,Rhiannon Gates,Ginger Craft
Rooney Moore,1-830-768-7948,Khyber Pakhtoonkhwa,23194,"sem egestas blandit. Nam nulla magna, malesuada vel, convallis in,",7,$68.32,Ukraine,3,dolor@aol.net,Marvin Nguyễn,Neque Sed Industries,Cameron Boyd,Winifred Mcconnell,Holmes Aguirre,Lenore Sharpe,Denton Sandoval,Clementine Hart,Neil Trujillo
Jena Castro,(765) 338-6847,Vorarlberg,313771,sit amet risus. Donec egestas. Aliquam nec enim. Nunc ut,4,$32.07,Pakistan,5,ut.pellentesque.eget@icloud.edu,Bruno Nguyễn,Diam Nunc Company,Madeline Harmon,Justine Gilbert,Cullen Cruz,Hammett Fitzgerald,Austin Powell,Autumn Walters,Yael Rivas
Keiko Santos,1-541-552-3614,British Columbia,8196,"Aenean egestas hendrerit neque. In ornare sagittis felis. Donec tempor,",4,$15.64,Philippines,19,nec@icloud.ca,Emerald Nguyễn,Nec Orci Corporation,Vaughan Leblanc,Curran Graves,Aretha Henry,Conan Luna,Lael Bright,Alden Wyatt,Mohammad Rosales
Carissa Hodge,1-684-260-7616,Gyeonggi,947676,elit. Nulla facilisi. Sed neque. Sed eget lacus. Mauris non,3,$77.38,Brazil,11,rutrum.magna.cras@icloud.com,Ursa Nguyễn,Interdum Ltd,Grant Buck,Eagan Haynes,Candice Finley,Kristen Wright,Brandon Mosley,Velma Hendrix,Kathleen Mullins
Shea Norris,1-522-717-6651,Lazio,415977,"Nunc mauris sapien, cursus in, hendrerit consectetuer, cursus et, magna.",2,$16.90,United Kingdom,13,proin.dolor@icloud.edu,Evan Nguyễn,Est Nunc Laoreet Industries,Tanisha Cochran,Gillian Herman,Salvador Santiago,Brenden Chandler,Kessie Green,Seth Thomas,Walker Williamson
Deborah Marsh,1-606-321-0736,Free State,2971,"felis purus ac tellus. Suspendisse sed dolor. Fusce mi lorem,",9,$72.39,Indonesia,11,ac.sem.ut@aol.ca,Knox Nguyễn,Tempor Arcu Vestibulum Associates,Leonard Mcneil,Vielka Harvey,Belle Estes,Aquila Griffith,Shellie Williams,Brock Reyes,Ivana Evans
Dante Blevins,(714) 476-5380,Dadra and Nagar Haveli,13001,interdum feugiat. Sed nec metus facilisis lorem tristique aliquet. Phasellus,1,$97.01,Poland,5,proin.eget.odio@protonmail.org,Kirestin Nguyễn,Nec Urna Suscipit Ltd,Cara Wade,Galvin Roberson,Joel Bean,Kameko Mayo,Sierra Greene,Caldwell Morris,Erasmus Shepard
Zane Patterson,1-221-542-8319,Saarland,ZQ71 8EP,"metus urna convallis erat, eget tincidunt dui augue eu tellus.",5,$97.26,France,17,vestibulum.mauris@yahoo.edu,Kay Nguyễn,Sed Pede PC,Charity Gray,Adria Dudley,Walker Mcneil,Malcolm Tyson,Olympia Black,Hillary Wolfe,Garth Wise
Eagan Hatfield,1-228-513-2486,łódzkie,3968,"libero et tristique pellentesque, tellus sem mollis dui, in sodales",9,$83.25,United States,11,nunc.commodo@yahoo.org,Lester Nguyễn,Aliquet Nec Limited,Georgia Mayo,Arsenio Newman,Davis Moran,Yasir Meadows,Arsenio Allen,Todd Mcintosh,Mikayla Graham
Nash Buckner,1-419-687-9447,Punjab,71718,"lorem, vehicula et, rutrum eu, ultrices sit amet, risus. Donec",8,$48.27,Philippines,1,netus.et.malesuada@google.ca,Orlando Nguyễn,Pede Sagittis Augue Foundation,Ahmed Ratliff,Ruth Price,Fallon Burch,Tasha Tucker,Abra Aguilar,Kareem Chavez,Lani Golden
Austin Fletcher,1-807-466-1796,Guanacaste,12187,"semper et, lacinia vitae, sodales at, velit. Pellentesque ultricies dignissim",7,$1.81,Spain,11,elementum@hotmail.ca,Zeph Nguyễn,Egestas A Dui Institute,Leigh Berry,Lamar Mclaughlin,Jasmine Tanner,Kristen Marshall,Jerry Franco,Gabriel Mcintyre,Susan Burks
Edan Warren,(508) 327-7324,Morelos,9114,"torquent per conubia nostra, per inceptos hymenaeos. Mauris ut quam",0,$3.87,Austria,13,lobortis.risus.in@outlook.ca,Maya Quan,Semper Egestas Limited,Gannon Boyd,Lavinia Bryant,Michael Parker,Hunter Lowe,Hannah Blankenship,Ronan Zamora,Mariko Guerrero
Germane Vasquez,(225) 448-2474,KwaZulu-Natal,367446,volutpat. Nulla dignissim. Maecenas ornare egestas ligula. Nullam feugiat placerat,4,$56.18,Ireland,15,diam@yahoo.edu,Renee Vũ,Tortor Ltd,Amelia Cleveland,Barbara Delgado,Farrah White,Chastity Bowman,Forrest Boone,Noah Steele,Merrill Farmer
Prescott Mitchell,(335) 713-0052,Jeju,3551,"Aenean egestas hendrerit neque. In ornare sagittis felis. Donec tempor,",5,$51.06,United States,17,dui.quis@outlook.couk,Angelica Nguyễn,Massa Non Ante LLC,Troy Harper,Lester Cox,Burton Bright,Abraham Alexander,Jasper Guthrie,Perry Flores,Holmes Morin
