name,phone,region,postalZip,text,numberrange,currency,country,list,email,name1,company,name2,name4,name3,name5,name6,name7,name8
Wayne O'connor,1-257-312-5538,West Region,618814,malesuada malesuada. Integer id magna et ipsum cursus vestibulum. Mauris,7,$81.20,Nigeria,15,pretium.neque@hotmail.ca,Willow Nguyễn,Fusce PC,Curran Velez,Sigourney Lloyd,Carlos Hull,Ali Lara,Alisa Flores,Fletcher Mooney,Imogene Mercado
Austin Good,1-638-735-8746,Gyeonggi,41101,erat eget ipsum. Suspendisse sagittis. Nullam vitae diam. Proin dolor.,4,$96.32,Canada,1,per.conubia.nostra@yahoo.ca,Hu Nguyễn,Mauris Id Foundation,Hedley Avila,Phillip Kim,Dale Salas,Malcolm Mccray,Dahlia George,Forrest Lara,Tarik Stuart
Justine Whitehead,(203) 442-7701,Hidalgo,40518,non lorem vitae odio sagittis semper. Nam tempor diam dictum,3,$99.03,Russian Federation,17,eu@yahoo.org,Blythe Nguyễn,Aliquet Sem Institute,Kevin Pace,Kirestin Caldwell,Giselle Sykes,Norman Vega,Alice Bean,Cassady Sparks,Gloria Garrett
Baxter Ratliff,1-347-846-1411,Imo,5554,eros turpis non enim. Mauris quis turpis vitae purus gravida,4,$68.18,Brazil,3,id.blandit@google.edu,Raymond Vân,Consectetuer Adipiscing Consulting,Lucian Preston,Julie Sims,Cullen Herman,Bell Lewis,Stuart Barry,Shay Shields,Lael Mayo
Nasim Castaneda,1-170-259-9675,Nordland,47-56,"sit amet, dapibus id, blandit at, nisi. Cum sociis natoque",10,$54.95,Singapore,13,pellentesque@google.net,Brenda Nguyễn,A Arcu Foundation,Bertha Jackson,Dominique Brady,Cassandra Hale,Winter Franklin,Clio Stewart,Reece Holt,Camden Burch
Cheyenne Sharpe,(484) 398-4177,Oyo,24-68,eros non enim commodo hendrerit. Donec porttitor tellus non magna.,0,$18.69,Mexico,3,eu@google.com,Kieran Nguyễn,Praesent Interdum LLP,Brielle Russo,Alyssa Medina,Illiana Osborn,Magee Holland,Marsden Gibbs,Vera Macdonald,Isabelle House
Hector Roberson,(265) 840-6466,Schleswig-Holstein,7035,"molestie sodales. Mauris blandit enim consequat purus. Maecenas libero est,",3,$31.70,Singapore,3,mauris.non@aol.com,Whoopi Hình,Interdum Enim Limited,Willa Morales,Calista Hurst,Micah Johnson,Yvonne Bradley,Clementine Sheppard,Ferdinand Slater,Willa Moss
Winter Weaver,(973) 994-9225,North Island,21406,ligula. Aenean gravida nunc sed pede. Cum sociis natoque penatibus,7,$26.70,Norway,17,cras@outlook.edu,Yuri Nguyễn,Neque Sed Limited,Ignacia Hoffman,Rama Griffin,Ingrid Mills,Ina Ward,Karleigh Savage,Mechelle Stafford,Hollee Johnson
Honorato Black,1-582-255-8438,Trøndelag,847164,scelerisque scelerisque dui. Suspendisse ac metus vitae velit egestas lacinia.,6,$61.90,Italy,5,velit@hotmail.edu,Olga Nguyễn,Dui Fusce Corporation,Melinda Padilla,Ulla Pollard,Brynn Romero,Judah White,Hayfa Salazar,Miriam Deleon,Wade Burks
Moana Frost,(674) 736-1793,Eastern Visayas,326500,pede. Praesent eu dui. Cum sociis natoque penatibus et magnis,5,$42.56,Russian Federation,3,dictum.eu@hotmail.net,Adrian Nguyễn,Ac Sem LLC,Dominic Joyce,Hope Pearson,Hamish Schultz,Jillian Rodriquez,Veronica Maxwell,Emerald Durham,Cheyenne Hebert
Shelly Buchanan,1-223-412-2323,Dolnośląskie,6225,"accumsan convallis, ante lectus convallis est, vitae sodales nisi magna",8,$86.36,Philippines,13,non@hotmail.org,Karen Nguyễn,Odio Tristique Foundation,Shea Richards,Clinton Hodge,Macey Atkins,Brandon Mitchell,Linda Vance,Cassady Beasley,Phoebe Hernandez
Rinah Dickson,(889) 361-7104,Caquetá,3338,Sed eu nibh vulputate mauris sagittis placerat. Cras dictum ultricies,8,$84.35,Netherlands,3,sit@icloud.ca,Sheila Nguyễn,Risus Inc.,Camille Brock,Jemima Schultz,Sigourney Woodard,Penelope Velazquez,Anthony Hoffman,Kelsie Guthrie,Brett Maxwell
Octavia Ballard,1-450-411-4170,Alajuela,83-122,sapien. Nunc pulvinar arcu et pede. Nunc sed orci lobortis,7,$6.23,New Zealand,5,sed.pede@google.com,Callum Nguyễn,Sit Amet LLC,Nathan Woodward,Jolie Owens,Pamela Prince,Angelica Golden,Nathan Barlow,Lucian Mccall,Serina Kramer
Lee Hensley,(642) 353-6411,Western Australia,493671,vitae risus. Duis a mi fringilla mi lacinia mattis. Integer,3,$32.09,United States,19,justo.sit@aol.ca,Zoe Thang,Sapien Molestie LLC,Leilani Ferrell,Charlotte Henderson,Jacqueline Simpson,Lynn Ramsey,TaShya Day,Abraham Bullock,Nehru Hampton
Fay Estes,(766) 304-7085,British Columbia,53461,nec orci. Donec nibh. Quisque nonummy ipsum non arcu. Vivamus,3,$73.63,Pakistan,5,donec.porttitor.tellus@protonmail.edu,Lester Nguyễn,Turpis Nec Inc.,Maia Villarreal,Cassidy Chavez,Fay Sawyer,Nehru Hawkins,Tyrone Clayton,Sandra Cox,Jacqueline Guerrero
Brett Herrera,(255) 267-1682,Rogaland,263181,Integer id magna et ipsum cursus vestibulum. Mauris magna. Duis,9,$21.70,Australia,7,ligula.elit@aol.ca,Aline Lam,Enim Corp.,Bree Marquez,Daryl Terry,Angela Knox,Lev Christian,Elvis Chan,Cooper Alston,Emmanuel Glenn
Ivana Porter,1-623-406-6958,North Island,145662,Nunc quis arcu vel quam dignissim pharetra. Nam ac nulla.,1,$33.37,Vietnam,5,est.mauris@icloud.org,Brian Nguyễn,Rutrum Inc.,Tarik Harmon,Kristen Kirkland,Lucius Reid,Keely Anthony,Xanthus Giles,Raymond Russo,Frances Martinez
Lee Larsen,(594) 183-8553,Guanacaste,34-56,Vestibulum accumsan neque et nunc. Quisque ornare tortor at risus.,8,$48.63,China,19,nullam.suscipit@icloud.org,Hedy Nguyễn,Risus Associates,Nerea Carlson,Ryan Johnston,Wing Christensen,Upton Shaw,Imelda Smith,Baker Ryan,Isaac Holman
Myra Franklin,(437) 671-5074,Oklahoma,26633,"dui lectus rutrum urna, nec luctus felis purus ac tellus.",10,$57.12,Chile,3,aliquet.sem@google.ca,Maisie Nguyễn,Mauris Vestibulum Neque LLC,Yardley Whitney,Kato Mcclain,Zachary Wheeler,Octavia Kirkland,Cassady Perez,Reed Bruce,Bo Romero
Danielle Patrick,1-737-983-3735,Morelos,35192,"rutrum urna, nec luctus felis purus ac tellus. Suspendisse sed",1,$90.92,Ukraine,7,curabitur.vel@aol.ca,Asher Nguyễn,Phasellus Ornare Fusce Incorporated,Rowan Nelson,Wing Boone,Melinda Trevino,Lamar Cooke,Ira Oneil,Francis Hester,Nolan Lawson
Renee Bartlett,(353) 853-9474,Chandigarh,987785,Morbi sit amet massa. Quisque porttitor eros nec tellus. Nunc,6,$51.27,Canada,11,quis.accumsan@protonmail.couk,Alexa Dư,Tortor Associates,Odysseus Johnston,Kylan Brock,Serina Butler,Bruce Ramirez,Kennan Whitley,Aladdin Pugh,Galena Vargas
Mannix Gilliam,(733) 306-4249,New South Wales,T6T 7X5,auctor velit. Aliquam nisl. Nulla eu neque pellentesque massa lobortis,7,$13.91,Canada,17,sit@icloud.ca,Lydia Nguyễn,Montes LLP,Tanek Kaufman,Sylvia Peterson,Vladimir Padilla,Jerry Bolton,Ulla O'donnell,Lilah Harrison,Ethan Larsen
Shelly Cherry,(683) 670-2117,Auvergne,142746,primis in faucibus orci luctus et ultrices posuere cubilia Curae,5,$59.62,Sweden,7,justo@outlook.org,Leonard Quản,Duis Sit Inc.,Lenore Bell,Nita Bowen,Colleen Short,Marcia Carr,Lewis Hensley,Gareth Key,Abel Townsend
Colby Mullen,1-771-816-6948,Innlandet,S8G 4K1,"non, cursus non, egestas a, dui. Cras pellentesque. Sed dictum.",8,$72.43,Mexico,17,nec.imperdiet.nec@yahoo.org,Diana Nguyễn,Augue Porttitor Ltd,Iola Rowland,Odette Romero,Baxter Hutchinson,Cody Pope,Keegan Barron,Ifeoma Sandoval,Galena Park
Tasha Haney,(358) 270-7438,Minas Gerais,6012,"pede, nonummy ut, molestie in, tempus eu, ligula. Aenean euismod",6,$90.28,Peru,13,quisque.nonummy@hotmail.couk,Grant Dư,Ultricies PC,Reese Bernard,Chaney Carey,Preston Mays,Rose Goodman,Iris Rosales,Beau Herrera,Russell Mccarty
Adria William,1-523-123-8676,Anambra,47871,"sociis natoque penatibus et magnis dis parturient montes, nascetur ridiculus",0,$12.80,Spain,3,netus@hotmail.ca,Neil Nguyễn,Nunc Interdum LLP,Mira Cunningham,Finn Vargas,Ruby Pate,Nehru Bradshaw,Hunter Rich,Deanna Walsh,Harlan Sanchez
Kylan Hebert,1-364-101-6881,West Region,96054,"enim. Suspendisse aliquet, sem ut cursus luctus, ipsum leo elementum",1,$38.43,South Korea,5,enim.diam@outlook.ca,Maya Phó,Interdum Libero PC,Hammett Harper,Tamekah Grimes,Moses Fernandez,Xantha Brady,Susan Tyler,Dillon Hicks,Zorita Alvarez
Megan Clark,1-424-657-6937,Australian Capital Territory,533337,"in magna. Phasellus dolor elit, pellentesque a, facilisis non, bibendum",2,$28.63,Norway,13,porttitor.interdum@yahoo.net,Lysandra Trịnh,Cursus Ltd,Erasmus Mccormick,Keefe Nunez,Travis Shields,Kylan Kelley,Jeremy Houston,Evan Levine,Armando Mills
Len Skinner,1-761-529-3478,British Columbia,362623,id enim. Curabitur massa. Vestibulum accumsan neque et nunc. Quisque,5,$39.50,Canada,17,etiam.laoreet.libero@hotmail.edu,Castor Nguyễn,Pede Nonummy Corp.,Yuri Orr,Cyrus Frederick,Wynne Sanford,Dorothy Clay,Armando Chapman,Stacey Brewer,Charde Mcknight
Claire Workman,(681) 488-9744,Gauteng,542628,"sem ut cursus luctus, ipsum leo elementum sem, vitae aliquam",9,$55.32,Mexico,3,elementum.dui@google.net,Urielle Đái,Interdum Enim Incorporated,Amber Mccarty,Honorato Suarez,Camilla Valdez,Riley Hess,Pascale Harding,Louis Gallegos,Anne Robertson
MacKenzie Case,1-321-842-3847,Chihuahua,873333,dapibus quam quis diam. Pellentesque habitant morbi tristique senectus et,3,$95.93,Chile,17,facilisis.suspendisse@hotmail.ca,Velma Nguyễn,Placerat Eget Venenatis Industries,Jenna Juarez,Savannah James,Hasad Miranda,Brenna Sanders,Lev Mendoza,Sandra Franks,Rahim Hendricks
Fritz Wagner,(234) 894-9118,Delaware,306258,"et, euismod et, commodo at, libero. Morbi accumsan laoreet ipsum.",4,$25.72,China,5,maecenas@protonmail.org,Adam Chân,Nulla Facilisi Inc.,Tad Guzman,Solomon Gaines,Francis Wiggins,Branden Sykes,Brianna Franco,Amela Gardner,Kato Barnett
Fay Cortez,(185) 656-2662,Chelyabinsk Oblast,3735,sagittis placerat. Cras dictum ultricies ligula. Nullam enim. Sed nulla,2,$43.14,Sweden,19,curabitur.sed@hotmail.ca,Harrison Nguyễn,Ligula Corporation,William Reilly,Petra Steele,Idola Hutchinson,Victor Munoz,Ryan Austin,Malachi Salas,Maggie Alston
Tatum Fletcher,(751) 528-1241,Stockholms län,2962,"Nunc ac sem ut dolor dapibus gravida. Aliquam tincidunt, nunc",9,$41.84,Australia,19,metus.vivamus@google.couk,Cameron Nguyễn,Lectus Pede Corporation,Forrest Taylor,Silas Bradford,Madeline Hopkins,Hayley Kaufman,Walker Miles,Kasper Leach,Kim Cain
Dexter Ramos,1-228-304-1212,Zhōngnán,375528,Etiam imperdiet dictum magna. Ut tincidunt orci quis lectus. Nullam,2,$52.19,Pakistan,3,magna.nam@outlook.org,Jason Nguyễn,Enim Etiam Institute,Laurel Rosales,Knox Avila,Laith Spears,Kamal Hunter,Cecilia Foreman,Destiny Guthrie,Emmanuel Gonzales
Karleigh Watts,1-856-166-3813,North Jeolla,25J 5X5,libero. Proin mi. Aliquam gravida mauris ut mi. Duis risus,9,$61.30,Poland,5,velit@aol.net,Virginia Vĩnh,Suspendisse Dui Fusce Inc.,Ivory Slater,Irene Callahan,Lucy Mitchell,Maggy Brown,Nissim Jarvis,Tad Cantrell,Angelica Osborn
Jade Houston,(212) 335-3576,Noord Holland,27637,eleifend. Cras sed leo. Cras vehicula aliquet libero. Integer in,6,$55.78,Mexico,3,purus.ac.tellus@icloud.ca,Gillian Đồ,Eleifend Cras Sed Ltd,Laith Brewer,Thor Evans,Nathaniel Spears,Camilla Figueroa,Iola Espinoza,Brody Kennedy,Jakeem Carpenter
Hanae Coffey,(804) 594-2657,Veracruz,885955,convallis dolor. Quisque tincidunt pede ac urna. Ut tincidunt vehicula,5,$37.23,United Kingdom,19,malesuada.augue@protonmail.edu,Zachery Xế,Dui Corporation,Dane Bentley,Jacob Cline,Lydia Wells,Chadwick Ortega,Amos Snider,Duncan Douglas,Shelby Leach
Sasha Norton,1-204-286-4674,Odessa oblast,431827,"risus. Donec nibh enim, gravida sit amet, dapibus id, blandit",3,$19.88,Austria,1,quisque.libero.lacus@outlook.ca,Vielka Nguyễn,Nulla Facilisis Ltd,Gary Sheppard,Jaquelyn Harvey,Lavinia Clements,Reuben Pena,Gillian Garza,Teegan Hodge,Alana Richardson
Alexandra Rocha,1-822-554-4332,Paraná,18931,magna a neque. Nullam ut nisi a odio semper cursus.,1,$50.90,Austria,11,dolor.vitae@protonmail.edu,Graiden Nguyễn,Consectetuer Euismod Ltd,Xantha Ashley,Wing Osborn,Bruce Mccall,Jackson Cervantes,Porter Stephenson,Otto Harvey,Candice Malone
Charles Burt,1-553-387-1227,Yorkshire,14605,Nam tempor diam dictum sapien. Aenean massa. Integer vitae nibh.,10,$41.28,South Korea,19,arcu@google.com,Joelle Nguyễn,Libero Associates,Gabriel Daniels,Tamara Hart,Claudia Fulton,Emerson Pruitt,Zia Lara,Walker Stanton,Kadeem Wyatt
Aspen Poole,1-307-887-8571,Novosibirsk Oblast,32-64,felis. Nulla tempor augue ac ipsum. Phasellus vitae mauris sit,1,$84.11,Colombia,17,gravida.mauris@google.ca,Armando Nguyễn,Vel Venenatis Associates,Octavius Alston,Amanda Talley,Elijah Bean,Hyacinth Benton,Illana Woods,Iona Randall,Cleo Murphy
Byron Battle,1-873-810-2593,South Island,241784,"elementum at, egestas a, scelerisque sed, sapien. Nunc pulvinar arcu",7,$83.62,Nigeria,9,aliquam.nisl@hotmail.org,Rebekah Nguyễn,Ornare Foundation,Cailin Hill,Sierra Knowles,Brendan Hatfield,Samuel Mcneil,Jemima Hyde,Mia Ellis,Shad Mcclure
Norman Aguilar,(986) 386-6876,Victoria,924716,ipsum. Phasellus vitae mauris sit amet lorem semper auctor. Mauris,5,$42.13,Colombia,11,lobortis.risus.in@yahoo.org,Cara Nguyễn,Aliquam Iaculis Limited,Brianna Rowland,Hayley Morin,Daniel Beasley,Martin Norman,Chase Franklin,Benjamin Booth,Penelope Head
Mason Green,(323) 138-6714,South Island,51618,Proin ultrices. Duis volutpat nunc sit amet metus. Aliquam erat,5,$66.09,Poland,11,lectus.justo.eu@yahoo.org,Vivian Ngư,Tellus Sem Associates,Victoria Sparks,Jarrod Frank,Daquan Campbell,Shaeleigh Prince,Althea Robertson,Veronica Mills,Scott Burgess
Chaim Stewart,1-489-501-1401,Aragón,7573,non enim commodo hendrerit. Donec porttitor tellus non magna. Nam,7,$27.76,India,1,phasellus.ornare@aol.couk,Ocean Nguyễn,Lectus Justo Foundation,Wesley Romero,Veda Shepard,Bell Olson,Lucius Meadows,Isabelle Jacobson,Jana Riley,Warren Garza
Nina Hurst,1-812-212-2475,Kharkiv oblast,939574,"Ut tincidunt orci quis lectus. Nullam suscipit, est ac facilisis",6,$45.69,Singapore,7,erat.eget.tincidunt@aol.edu,Claudia Nguyễn,Libero Proin Corp.,Igor Acosta,Vladimir Simmons,Craig Potter,Astra Mccall,Laith Le,Xenos Sanford,Quinn Reid
Colt Tanner,(693) 751-8715,Distrito Capital,3077,"eu, odio. Phasellus at augue id ante dictum cursus. Nunc",6,$69.40,New Zealand,3,magna.sed@icloud.net,Tatyana Dung,Vulputate Eu Odio LLP,Caldwell Richards,Lance Langley,Alfonso Ashley,Vera Mcfadden,Tyler Ramirez,Ryder Vincent,Latifah Merritt
Sebastian Foreman,(883) 702-3132,Munster,825578,"sed dui. Fusce aliquam, enim nec tempus scelerisque, lorem ipsum",3,$71.83,South Africa,17,mattis@aol.couk,Yvonne Tiêu,Cras Interdum Corp.,Brenda Phelps,Jolie Shelton,Salvador Sellers,Alden Rhodes,Axel Pearson,Arthur Stuart,Rosalyn Schwartz
