name,phone,region,postalZip,text,numberrange,currency,country,list,email,name1,company,name2,name4,name3,name5,name6,name7,name8
Maggie Luna,1-476-675-6641,Lampung,3422,"dolor egestas rhoncus. Proin nisl sem, consequat nec, mollis vitae,",5,$30.59,United Kingdom,9,aliquet@protonmail.couk,Whoopi Miêu,Donec At Arcu Ltd,Walter Robertson,Fuller Savage,Cooper Richmond,Fredericka Davis,Emmanuel Cote,Nigel Mccarty,Tamara Ray
Unity Atkinson,(686) 552-4025,New South Wales,05553,nec metus facilisis lorem tristique aliquet. Phasellus fermentum convallis ligula.,7,$19.24,Norway,7,rutrum.non.hendrerit@hotmail.net,Erin Nguyễn,At Lacus Industries,Cameran Alvarez,Hyacinth Mathis,Dustin Tate,Denise Christian,Garrett Puckett,Ruth Golden,Luke Kidd
Jamalia Melendez,1-903-772-2331,Huádōng,08600,neque. Nullam nisl. Maecenas malesuada fringilla est. Mauris eu turpis.,9,$50.72,Norway,7,at.lacus@google.couk,Roary Khổng,A Aliquet Associates,Porter House,Madison Oneal,Yardley Meyer,Desiree Howell,Vera Blevins,Travis Woodard,Jessica Hood
Colton Joyner,1-566-564-7167,Soccsksargen,7417-3886,Sed molestie. Sed id risus quis diam luctus lobortis. Class,4,$21.54,Indonesia,7,sed@google.couk,Ferris Vân,Tristique Pharetra Limited,Lacey Barrett,Amanda Tillman,Jayme Alexander,Quamar Warner,Angela Chandler,Kylie Blevins,Blossom Wilder
Upton Howe,(462) 137-0104,Utrecht,62607,Nam tempor diam dictum sapien. Aenean massa. Integer vitae nibh.,6,$83.08,Canada,17,in@protonmail.ca,Theodore Nguyễn,Donec Luctus Institute,Callie Mathis,Sean Frye,Keely Montgomery,Kaye Cameron,Nyssa Anthony,Isaiah Dawson,Tamekah Benton
Nash Hoover,(687) 788-5586,Bahia,385428,In nec orci. Donec nibh. Quisque nonummy ipsum non arcu.,9,$5.28,China,7,sapien.cras@hotmail.com,Gemma Nguyễn,Sit Amet PC,Dahlia Marshall,Sean Kelley,Yeo Landry,Lana Knox,Lionel Mcneil,Tana Wilkins,Demetria Green
Adam Reynolds,1-608-541-8948,Podlaskie,15891,"scelerisque mollis. Phasellus libero mauris, aliquam eu, accumsan sed, facilisis",1,$10.22,Indonesia,5,eget.volutpat@icloud.couk,Walker Nguyễn,Arcu Sed Corporation,Vernon Wiggins,Nash Welch,Nero Hopkins,Aristotle Miller,Thor Langley,Miriam Mccormick,Kevyn Graves
Pascale Rivers,1-698-669-5518,Lambayeque,18181,Nullam ut nisi a odio semper cursus. Integer mollis. Integer,5,$3.40,Brazil,19,lacus.mauris.non@outlook.couk,Lana Nguyễn,Sed Pede Limited,Jason Watson,Cody Henry,Madonna Barnes,Howard Burks,Paul Hoover,Gregory Stephens,Rogan Terrell
Richard Logan,(541) 536-9074,Xīběi,39081,risus quis diam luctus lobortis. Class aptent taciti sociosqu ad,1,$94.39,Austria,13,ut.lacus.nulla@outlook.net,Karen Nguyễn,Eleifend Foundation,Fuller Morris,Ainsley Bennett,Leroy Leblanc,Hanae Vaughn,Medge Drake,Benjamin Shaw,Zachery Ashley
Naomi Wolf,(277) 348-2268,Ilocos Region,604580,magna. Sed eu eros. Nam consequat dolor vitae dolor. Donec,5,$75.94,Peru,7,dui.cras@icloud.ca,Idola Nguyễn,Dictum Proin Inc.,Camille Fox,Lee Key,Samson Glenn,Illana Carroll,Holly Garrett,Emi Townsend,Doris Maynard
Amanda Curtis,(351) 828-2254,Bremen,2429-9741,mauris erat eget ipsum. Suspendisse sagittis. Nullam vitae diam. Proin,3,$55.26,Turkey,19,ipsum.nunc@hotmail.com,Adrienne Nguyễn,A Scelerisque Sed Corp.,Cain Harrell,Brenna Levy,Irene Franklin,Vladimir Gillespie,Britanney Myers,Jael Woods,Eugenia Winters
Callum Coffey,(869) 522-8311,South Island,677150,"vitae velit egestas lacinia. Sed congue, elit sed consequat auctor,",5,$20.01,Peru,19,leo.morbi.neque@protonmail.org,Tamara Nguyễn,Ultrices Iaculis Odio Incorporated,Henry Clay,Walker Hendrix,Giselle Holcomb,Keane Merritt,Peter Snyder,Malik Abbott,Lunea Stewart
Fitzgerald Richards,1-777-872-7273,Lincolnshire,6883,"facilisis non, bibendum sed, est. Nunc laoreet lectus quis massa.",8,$18.30,Italy,9,velit.quisque@google.edu,Michael Nguyễn,Molestie Tellus Aenean Corp.,Colby Oliver,Slade Slater,Hedley Faulkner,Samuel Vincent,Mikayla Ayala,Randall Goff,Rina Oneal
Nissim Olson,1-732-721-4600,Haryana,33656,arcu. Vivamus sit amet risus. Donec egestas. Aliquam nec enim.,10,$5.10,Ukraine,7,orci.adipiscing@hotmail.ca,Hilel Ngư,Ipsum Leo Associates,Shellie Knox,Wayne Noble,Jerry Anderson,Danielle Frye,Cyrus Dyer,Ginger Pugh,Ciara Cabrera
Malcolm Short,(202) 481-5764,Metropolitana de Santiago,27014,"fermentum risus, at fringilla purus mauris a nunc. In at",8,$87.27,Colombia,9,enim.gravida@yahoo.couk,Anastasia Nguyễn,Sapien Corp.,Holly Heath,Ginger Herrera,Pandora Davidson,Kuame Sykes,Elvis Lindsay,Kelly Heath,Jenna Pittman
Shellie Vazquez,(517) 685-2388,Nordrhein-Westphalen,08228,ut nisi a odio semper cursus. Integer mollis. Integer tincidunt,10,$15.97,Pakistan,17,tortor.dictum@protonmail.ca,Lionel Văn,Tincidunt Limited,Dai Gill,Blossom Rasmussen,Mohammad Barlow,Conan Hill,Kevyn Harrell,Carter Lyons,Felix Rich
Eric Diaz,1-924-975-2531,Leinster,51-783,"pharetra sed, hendrerit a, arcu. Sed et libero. Proin mi.",6,$8.63,Philippines,17,et.rutrum@yahoo.net,Jescie Nguyễn,Et Magnis Corp.,Quinlan Hicks,Joy Battle,Lyle Robbins,Carly Kirby,Colt Hancock,Yen Lloyd,Aimee Potts
Sade Hudson,(317) 873-3707,Rheinland-Pfalz,4082,in consequat enim diam vel arcu. Curabitur ut odio vel,8,$11.66,Netherlands,5,dolor.elit.pellentesque@google.couk,Keegan Nguyễn,Nisl Nulla Eu LLC,Doris Cohen,Mari Collier,Baker Bentley,Nathaniel Rogers,Blake Marquez,Elton Rivera,Mannix Hoffman
Imogene Forbes,(278) 815-8421,Małopolskie,5323,"iaculis aliquet diam. Sed diam lorem, auctor quis, tristique ac,",7,$31.01,France,3,mauris@protonmail.couk,Giacomo Nguyễn,Cursus Associates,Xyla Hewitt,Dora Castaneda,Odysseus Baxter,Colt Huff,Asher Hester,Amity Bass,Rana Hobbs
Aquila Phillips,(643) 313-9646,North Jeolla,5180,"pharetra ut, pharetra sed, hendrerit a, arcu. Sed et libero.",1,$90.49,Russian Federation,7,auctor.quis.tristique@hotmail.org,Colette Nguyễn,Neque Pellentesque Foundation,Leroy Simpson,Charity Kidd,Destiny Schultz,Elmo Brennan,Yardley Christensen,Brody Solomon,Simon Hoffman
Maxwell Donovan,(649) 288-6335,Cherkasy oblast,74X 8J3,"Sed auctor odio a purus. Duis elementum, dui quis accumsan",4,$2.92,Peru,17,fringilla.porttitor.vulputate@outlook.net,Bruce Nguyễn,Nunc Est PC,Declan Harris,Kirestin Eaton,Danielle Conrad,John Montgomery,Hayfa Carrillo,Clinton Parrish,Ian Burch
Camden Moon,(215) 215-6223,Guaviare,99638,"purus. Duis elementum, dui quis accumsan convallis, ante lectus convallis",3,$25.73,Russian Federation,9,ornare.lectus@aol.com,Xavier Thạch,Felis Purus Ac Corporation,Clarke Nieves,Abbot Ballard,Stacy Becker,Georgia Carson,Pascale Sexton,Patrick Welch,Merritt Marquez
Kasper Pacheco,1-955-611-6971,Oklahoma,88063-75336,"ligula consectetuer rhoncus. Nullam velit dui, semper et, lacinia vitae,",1,$28.90,Russian Federation,5,nunc.quisque@aol.edu,Desiree Nguyễn,Turpis Egestas LLP,Naida Gamble,Meredith Hooper,Signe Holcomb,Phyllis Franklin,Brett Jordan,Jenette Paul,Stella Mann
Avye Vinson,(785) 653-8948,Lagos,77136,"scelerisque neque sed sem egestas blandit. Nam nulla magna, malesuada",6,$84.11,Indonesia,5,ornare.lectus@google.org,Macaulay Nguyễn,Dapibus Gravida Company,Charlotte Rojas,Kylee Mcmahon,Eugenia Hays,Burke Lindsay,Geoffrey Wyatt,Bethany Ray,Lysandra O'donnell
Jerome Vazquez,(351) 461-6764,Loreto,5386,"commodo tincidunt nibh. Phasellus nulla. Integer vulputate, risus a ultricies",2,$8.13,Spain,13,pharetra@hotmail.ca,Rigel Nguyễn,Cursus A Incorporated,Avye Hayden,Jerome Daniel,Maite Swanson,Nomlanga Parrish,Price Smith,Kadeem Gamble,Stone Rosa
Kevyn Sandoval,1-750-546-4842,Liguria,6335-4755,velit. Pellentesque ultricies dignissim lacus. Aliquam rutrum lorem ac risus.,1,$44.39,Indonesia,15,magnis@google.net,Tobias Nguyễn,Non Sollicitudin A Industries,Carissa Case,Quentin Watts,Maisie Daniels,Cecilia Hewitt,Kirk Pope,Kay Chang,Bell Christian
Kirby Gross,1-258-764-7481,Extremadura,58800,"lacus, varius et, euismod et, commodo at, libero. Morbi accumsan",4,$18.20,Spain,1,elementum@outlook.org,Aileen Quảng,Lectus Rutrum Urna LLP,Tana Grant,Ivor Diaz,Ray Stanley,Venus Martin,Norman Hull,Abigail Yang,Katell Wise
Hillary Shaffer,1-515-547-6442,Zachodniopomorskie,208784,quam vel sapien imperdiet ornare. In faucibus. Morbi vehicula. Pellentesque,6,$28.34,United States,5,ut.mi@icloud.couk,Carl Nguyễn,Et Ultrices Incorporated,Justin Hurley,Zeus Reyes,Steven Hobbs,Sara Camacho,Kennan Hendricks,Sade Mcclure,Brady English
Ali Kirkland,(429) 374-3541,Zachodniopomorskie,82834,"leo elementum sem, vitae aliquam eros turpis non enim. Mauris",8,$45.23,Italy,3,donec.felis.orci@yahoo.org,Vera Nguyễn,Arcu Ltd,Emery Francis,Ciaran Delaney,Rajah Herring,Rigel Noel,Herrod Mayo,Kibo Roth,Yen Riley
Vernon Pittman,1-311-705-4436,Lubuskie,667346,tempor erat neque non quam. Pellentesque habitant morbi tristique senectus,3,$67.86,United Kingdom,3,nunc.ac@hotmail.ca,Zeph Nguyễn,Egestas Industries,Rhona Sherman,Coby Beach,Kirsten Chavez,Avye Vega,Alec Steele,Ora Johns,Mercedes Guzman
Yael Fry,1-212-377-0036,Los Lagos,241281,vel quam dignissim pharetra. Nam ac nulla. In tincidunt congue,6,$20.10,Russian Federation,3,curabitur@aol.com,Mia Nguyễn,Eget Lacus Corp.,Caleb Jones,Ali Shelton,Carl Neal,Colton Butler,Reuben Knapp,Nicholas Dickson,Neil Shelton
Jesse Crawford,(921) 317-0347,Ternopil oblast,444437,tellus id nunc interdum feugiat. Sed nec metus facilisis lorem,5,$6.10,Australia,1,enim.sed.nulla@aol.couk,Vincent Nguyễn,Nam Porttitor Scelerisque Corporation,Josiah Bush,Shoshana Eaton,Nathan Patel,Cynthia Blake,Alisa Mcpherson,Seth William,Warren Navarro
Colton Diaz,(106) 855-4354,Special Region of Yogyakarta,7349,egestas nunc sed libero. Proin sed turpis nec mauris blandit,4,$54.20,Singapore,13,ut.lacus@protonmail.couk,Addison Nguyễn,Sem Consequat Nec Corporation,Nyssa Briggs,Tatum Terrell,Sonya Mcfadden,Kevin Kane,Tana Waters,Odette Roberson,Marsden Burt
Mufutau Mayer,1-442-550-5527,Chelyabinsk Oblast,06233,Curae Phasellus ornare. Fusce mollis. Duis sit amet diam eu,4,$90.79,Netherlands,13,malesuada.fames@yahoo.com,Tamekah Nguyễn,Eget Volutpat Ltd,Clarke Mann,Erica Hansen,Allen Flores,Austin Mccormick,Lucy Maynard,Vladimir Sanford,Piper Booth
Paula Perkins,1-817-709-4027,Gävleborgs län,41644,et ultrices posuere cubilia Curae Donec tincidunt. Donec vitae erat,6,$75.08,Chile,7,consectetuer.rhoncus@icloud.net,Yoko Nguyễn,Ridiculus Foundation,TaShya Goff,Eleanor Monroe,Jordan Coleman,Octavius Dorsey,Dale Spencer,Eagan Lambert,Charles Spence
Sasha Wilcox,(918) 235-9597,Hamburg,7528,"ultrices a, auctor non, feugiat nec, diam. Duis mi enim,",8,$13.29,Canada,13,nibh@hotmail.net,Germane Nguyễn,Diam Pellentesque Associates,Zahir Perkins,Kasimir Clark,Yen Hunt,Zane Myers,Joelle Moon,Sawyer Evans,Lillian Holder
Berk Tanner,1-573-813-6273,West Kalimantan,6288,"placerat, augue. Sed molestie. Sed id risus quis diam luctus",6,$4.82,Vietnam,13,convallis@google.net,Cedric Nguyễn,Sed Pede Nec Inc.,James Duncan,McKenzie Durham,May Harvey,Herman May,Troy Cross,April Bender,Colin Chambers
Tad Franco,(473) 316-3103,Tyrol,36547,mauris. Morbi non sapien molestie orci tincidunt adipiscing. Mauris molestie,4,$62.17,Ireland,1,dapibus.gravida.aliquam@hotmail.net,Stephen Tạ,Scelerisque Sed Corporation,Alexander Cote,Aline Cantu,Len Love,Lana Maddox,Kyle Cameron,Maris Bolton,Honorato Bass
Lois Jackson,(748) 345-5684,Bicol Region,7720-8817,"vestibulum lorem, sit amet ultricies sem magna nec quam. Curabitur",7,$79.09,Austria,1,sed.molestie@protonmail.org,Dorian Nguyễn,Sem Egestas Blandit LLC,Walker Floyd,Hiram Duran,Indigo Romero,Dane Stevenson,Quon Sampson,Freya Spencer,Damon Harrington
Illana Kline,(387) 731-1266,Bauchi,15512,"penatibus et magnis dis parturient montes, nascetur ridiculus mus. Proin",9,$19.69,Chile,7,nunc@yahoo.org,Orla Nguyễn,Sodales Inc.,Rooney Bass,Thor Kent,Tyler Gibbs,Dexter Fitzpatrick,Dustin Crosby,Herman Coffey,Alexis Contreras
Karleigh Barry,1-978-883-8542,Vladimir Oblast,0862-9561,"a, dui. Cras pellentesque. Sed dictum. Proin eget odio. Aliquam",4,$67.68,Colombia,15,mollis.dui@aol.couk,Hedley Hầu,Lorem Ltd,Fulton Boyle,Olga Dickson,Nigel Hopper,Lamar Barker,Justin Rice,Andrew Gregory,Kirk Rhodes
Lillian Henson,(836) 232-7180,Vestland,4113,"et, rutrum eu, ultrices sit amet, risus. Donec nibh enim,",1,$36.43,Russian Federation,19,nunc@hotmail.org,Gareth Nguyễn,Interdum Curabitur LLC,Lavinia Hood,Rhona Butler,Davis Peters,Plato Guy,Gary Pugh,Wynne Gonzales,Graham Hampton
Raja Albert,(457) 803-4661,Western Australia,67467,"blandit viverra. Donec tempus, lorem fringilla ornare placerat, orci lacus",2,$27.24,Pakistan,19,nulla.donec@yahoo.ca,Joan Nguyễn,Eros Institute,Eric Hopper,Sade Jefferson,Marah Gordon,Zahir Wheeler,Elizabeth Melton,Nita Miller,Cheryl Hendrix
Baker Vargas,(549) 544-2382,Salzburg,91572,molestie. Sed id risus quis diam luctus lobortis. Class aptent,7,$33.59,Belgium,9,viverra.donec.tempus@icloud.edu,Charles Nguyễn,Ante Lectus Convallis Industries,Mark Carson,Kenyon Farmer,Zeph Short,Lara Mills,Vernon Johns,Kessie Welch,Noah Mullins
Nevada Barnett,(433) 597-0663,Tabasco,7441,Nulla semper tellus id nunc interdum feugiat. Sed nec metus,4,$92.72,Spain,3,tristique.senectus@google.net,Jordan Kỳ,Elementum Lorem Inc.,Hilda Owen,Randall Mcmahon,Maggy Wade,Talon Saunders,Moana Cross,Orlando Briggs,Colton Yang
Rama Barry,(372) 646-2717,West Region,313581,"nibh dolor, nonummy ac, feugiat non, lobortis quis, pede. Suspendisse",6,$78.86,Netherlands,13,sollicitudin.commodo@icloud.couk,Ursa Nguyễn,A Associates,Yoshio Anderson,Malik Bullock,Larissa Bradley,Igor Guerra,Stephen Mullen,Wendy Blackburn,Larissa Bishop
Ria Hicks,(657) 872-2785,Murcia,9156 NP,Phasellus fermentum convallis ligula. Donec luctus aliquet odio. Etiam ligula,5,$33.47,Sweden,11,non@aol.com,Jesse Nguyễn,Ac Tellus Ltd,Ava Peters,Belle Johns,Iona Torres,Naida Burton,Amber Rios,Julie Sullivan,Berk Herman
Bruno Shields,(291) 412-4833,Đồng Nai,6464,"auctor ullamcorper, nisl arcu iaculis enim, sit amet ornare lectus",4,$83.24,Costa Rica,15,massa.integer.vitae@icloud.org,Courtney Nguyễn,Quis Massa PC,Ferris Mack,Isabella Pollard,Brynne Johnson,Dana Cline,Baker Snider,Valentine Kerr,Bo Lyons
Sylvia Aguilar,(117) 529-6171,Northern Mindanao,6434,Quisque fringilla euismod enim. Etiam gravida molestie arcu. Sed eu,6,$41.22,Colombia,1,urna.et@protonmail.couk,Hammett Nguyễn,Suspendisse Ac Associates,Jenna Bennett,Jolene Valdez,Carl Houston,Randall Klein,Marshall Barlow,Zelda Pollard,Rowan Cherry
Herrod Foley,(710) 815-2023,Michigan,568309,turpis vitae purus gravida sagittis. Duis gravida. Praesent eu nulla,4,$50.36,United Kingdom,15,tellus.justo@google.org,Wing Nguyễn,Sem Ut Corporation,Molly Cote,Nelle Mccall,Faith Rowland,Thor Whitaker,Hamilton Velasquez,Cynthia Valenzuela,Aquila Murray
Adria Snider,1-762-342-3933,Connacht,45545,nunc sit amet metus. Aliquam erat volutpat. Nulla facilisis. Suspendisse,3,$13.99,New Zealand,7,lacinia@protonmail.couk,Olympia Thiện,Ut Semper Pretium Company,Abel Moon,Ashely Buckner,Lance Reynolds,Silas Summers,Dorian Mclaughlin,Cheyenne Turner,Philip Keith
Lilah Nelson,(533) 878-0367,Thanh Hóa,24618,dictum augue malesuada malesuada. Integer id magna et ipsum cursus,1,$10.26,Norway,13,donec.nibh@icloud.ca,Cassandra Nguyễn,Donec Elementum Inc.,Rhonda Williamson,Leo Terrell,Erasmus Burris,Basil Short,Ruth Park,Amery Alvarez,Shellie Mcfarland
Palmer Campbell,1-622-532-4155,West Java,233251,"hendrerit. Donec porttitor tellus non magna. Nam ligula elit, pretium",4,$14.00,Pakistan,19,cras@hotmail.org,Vance Nguyễn,Scelerisque Consulting,Quentin Atkinson,Karyn Hudson,Karyn Wilkinson,Orson Cole,Hakeem Davenport,Claudia Fitzgerald,Akeem Estes
Jacqueline Willis,(967) 954-4441,Michoacán,797203,interdum. Curabitur dictum. Phasellus in felis. Nulla tempor augue ac,7,$36.42,Ireland,7,phasellus.in@outlook.edu,Ruth Nguyễn,Mi Pede Nonummy Inc.,Stone Hunter,Teagan Buckner,Jarrod Wiley,Kathleen Mccullough,Kiayada Bray,Jeremy Williamson,Tucker Medina
Aidan Torres,(345) 912-4169,Sardegna,314157,"posuere vulputate, lacus. Cras interdum. Nunc sollicitudin commodo ipsum. Suspendisse",0,$41.99,Sweden,3,mattis@aol.edu,Courtney Nguyễn,A Ltd,Jaquelyn Emerson,Chastity Gilmore,Meredith Mcclain,Kimberley Gaines,Chiquita Harrington,Dominic Petersen,Alika Morales
Clio Booth,(761) 422-8548,South Island,65260,vitae dolor. Donec fringilla. Donec feugiat metus sit amet ante.,0,$32.97,South Africa,1,eget.massa@yahoo.couk,Jenette Nguyễn,Dapibus Id Blandit PC,Deanna Cochran,Addison Baird,Signe Montgomery,Eaton Mejia,Ariel Alford,Ronan Ingram,Raya Hardin
Rhoda Shelton,(274) 839-1415,Antioquia,Y1P 8H4,"Maecenas libero est, congue a, aliquet vel, vulputate eu, odio.",1,$87.10,India,19,mauris@google.net,Jennifer Nguyễn,Metus Industries,Kyra Bishop,Kylynn Logan,Gage Carpenter,Wallace Avila,Ramona Pope,Justina Jenkins,Heather Chandler
Raymond Sharp,(814) 371-8765,Madhya Pradesh,21311,bibendum fermentum metus. Aenean sed pede nec ante blandit viverra.,1,$25.05,Canada,3,nulla@protonmail.com,Hedley Cát,At Velit Incorporated,Debra Fernandez,Barry Houston,Avye Holloway,Dexter Buckley,Colby Odom,Chelsea Eaton,Kaye Garza
Ina Christian,(456) 859-8861,Guanacaste,2177,"cursus luctus, ipsum leo elementum sem, vitae aliquam eros turpis",9,$36.55,South Korea,7,sit@yahoo.net,Adria Trác,Cum Sociis PC,Barrett Yates,Kuame Rutledge,Lyle Mcfadden,Jordan Finley,Bell Downs,Alexandra Wise,Todd Holcomb
Macon Donaldson,1-279-762-7867,Eastern Cape,758141,"id ante dictum cursus. Nunc mauris elit, dictum eu, eleifend",0,$43.59,Brazil,5,ridiculus.mus@icloud.com,Stewart Nguyễn,Eros Nec Industries,Ralph Riley,Jacqueline Lott,Ivan Valentine,Alexander Crosby,September Callahan,James Gibbs,Demetria Moody
Marcia Vazquez,(262) 565-5993,Volgograd Oblast,4252,"Donec elementum, lorem ut aliquam iaculis, lacus pede sagittis augue,",1,$27.88,Norway,15,egestas@outlook.net,Henry Nguyễn,Pellentesque Massa Foundation,Kuame Parks,Louis Koch,Aline Andrews,Randall Santiago,Garth Johnston,Madison Olson,Asher Mathis
Berk Fletcher,1-490-743-6403,East Region,5531,"in, tempus eu, ligula. Aenean euismod mauris eu elit. Nulla",6,$81.59,Belgium,3,cras.dictum@protonmail.ca,Myra Văn,Ante Dictum Mi LLP,Bree Cross,Leo Collier,Alyssa Chase,Ainsley Forbes,Carly Warner,Deanna Willis,Sylvester Erickson
Quinlan Wyatt,1-771-730-3872,Dōngběi,7717,"ac libero nec ligula consectetuer rhoncus. Nullam velit dui, semper",5,$97.82,Ireland,13,consequat.nec@protonmail.ca,Tamekah Nguyễn,Mauris Ut Quam Limited,Caldwell Collier,Lisandra Osborne,Kareem Castro,Jerome Michael,Sybil Callahan,Kyle Lawrence,Kalia Mcguire
Mannix Mitchell,1-412-654-3927,Alberta,32486,"scelerisque, lorem ipsum sodales purus, in molestie tortor nibh sit",6,$61.03,United Kingdom,13,proin.mi@hotmail.couk,Alfonso Nguyễn,Sed LLP,Wynne Matthews,Tate Walter,Miranda Villarreal,Aaron Cummings,Nell Alvarado,Willow Rodriquez,Fritz Blake
Guy Shaw,(856) 495-6046,Aydın,48195,"Cum sociis natoque penatibus et magnis dis parturient montes, nascetur",9,$25.74,Philippines,17,ridiculus.mus.donec@aol.ca,Alfonso Nguyễn,Volutpat Ornare LLP,Fritz Aguirre,Jennifer Lara,Sigourney Ortiz,Colt Delaney,Orla Valdez,Ray Ford,Carly Todd
Orli Clayton,1-355-476-5561,São Paulo,58471,eros non enim commodo hendrerit. Donec porttitor tellus non magna.,6,$7.04,Poland,5,nulla.eget@protonmail.edu,Price Hình,Vitae Foundation,Beverly Strickland,Phoebe Gibson,Vielka Ruiz,Lars Hodges,Erasmus Cook,Dorothy James,Illana Wilcox
Jonah Howell,1-331-539-2891,İzmir,514418,"pede. Suspendisse dui. Fusce diam nunc, ullamcorper eu, euismod ac,",9,$18.93,Indonesia,3,risus.donec.egestas@hotmail.ca,Oprah Nguyễn,Feugiat Placerat Associates,Davis Merritt,Madison Doyle,Armando Holman,Keaton Meyers,Jacob Montoya,Baxter Fields,Kasimir Horton
Hayley Mccarty,1-373-658-3438,Galicia,68837,"at lacus. Quisque purus sapien, gravida non, sollicitudin a, malesuada",2,$31.04,Poland,17,purus.maecenas.libero@protonmail.org,Devin Nguyễn,Ac Sem Company,Ila Hogan,Leah Wilkins,Xanthus Dale,Flynn Stout,Dante House,Blaze Quinn,Jason Copeland
Martina Camacho,1-248-788-5347,Sląskie,51242,"Integer vulputate, risus a ultricies adipiscing, enim mi tempor lorem,",10,$66.02,Belgium,5,eleifend.cras@google.edu,Sylvester Nguyễn,Etiam Ligula Inc.,George Jarvis,Tucker Aguirre,Myra Cooper,Karly Walker,Kylie Mcconnell,Hayley Jackson,Xantha Willis
Steel Frost,(456) 477-8157,Paraná,28976,purus gravida sagittis. Duis gravida. Praesent eu nulla at sem,2,$42.42,Chile,5,vel.arcu.eu@protonmail.edu,Phoebe Nguyễn,In Hendrerit Associates,Dahlia Nguyen,Zane Clemons,Ava Lara,Roanna Pierce,Wallace Madden,Jael Perez,Elvis Christensen
Vladimir Hyde,1-458-945-2460,West Sumatra,960482,"lorem ipsum sodales purus, in molestie tortor nibh sit amet",6,$11.85,Canada,11,mauris@protonmail.ca,Kim Nguyễn,Risus Quis Institute,Jorden Eaton,Lilah Strong,Ryan Barnett,Vivian Rodgers,Jasmine Sharpe,Daquan Crawford,Lysandra Hopkins
Virginia Schroeder,(121) 282-0901,South Gyeongsang,S1S 1G9,gravida sagittis. Duis gravida. Praesent eu nulla at sem molestie,6,$94.63,United States,11,vestibulum@hotmail.org,John Nguyễn,Ligula Nullam Enim Ltd,Maile Hamilton,Oscar Roberts,Hedwig Bonner,Ciara Leonard,Slade Sosa,Harding Macias,Scarlett Kim
Tasha Sweeney,1-653-197-8083,Yukon,5295,"vel, mauris. Integer sem elit, pharetra ut, pharetra sed, hendrerit",6,$68.68,Singapore,9,semper.tellus@yahoo.org,Blake Nguyễn,A Felis Limited,James Browning,Richard Snider,Erica Collier,Herman Gilbert,Thomas Hester,Vera Ramsey,Gage Whitney
Andrew Allen,(318) 653-6524,East Region,50813,Nam ac nulla. In tincidunt congue turpis. In condimentum. Donec,2,$24.60,China,7,sed@outlook.org,Herman Thích,Magnis Dis Foundation,Merritt Nash,Fletcher Clarke,Barbara Barber,Cherokee Cardenas,Samantha Mccall,Hamilton Booker,TaShya Richards
Shelby Shields,1-440-433-0633,Norfolk,827667,eu tellus eu augue porttitor interdum. Sed auctor odio a,10,$58.46,Germany,7,turpis.vitae@protonmail.couk,Noah Nguyễn,Ipsum Sodales Institute,Cade Horton,Gannon Moreno,Beau Dunn,Velma Gates,Dawn Greer,Ginger Frye,Myles Bradford
Rogan Marshall,1-445-334-0853,Minas Gerais,6882 HA,"aliquam eu, accumsan sed, facilisis vitae, orci. Phasellus dapibus quam",8,$81.13,China,3,sed.pede@protonmail.couk,Kasper Nguyễn,Rutrum Lorem Ac PC,Craig Lee,Karleigh Cardenas,Ignacia Frazier,Jana Powers,Keefe Whitaker,Melyssa Lawson,Murphy Townsend
Michael Benton,1-557-684-5549,North-East Region,70701,lobortis tellus justo sit amet nulla. Donec non justo. Proin,3,$77.32,South Korea,3,pretium.neque@google.couk,Alana Nguyễn,Sodales Elit Erat Incorporated,Moana Shelton,Deacon Moore,Mariam Pennington,Justine William,Neville Rosales,Jasper Mclaughlin,Shannon Dillon
Elijah Strickland,(556) 435-7414,Sumy oblast,58122,"Ut tincidunt orci quis lectus. Nullam suscipit, est ac facilisis",1,$12.70,South Africa,7,montes@outlook.couk,Yoko Ngư,Eu Accumsan Associates,Branden Kent,Ciara Bridges,Sara Barrett,Bevis Lancaster,May Levy,Ina Waters,Portia Fuentes
Maisie Arnold,(826) 643-9693,Saarland,815223,euismod mauris eu elit. Nulla facilisi. Sed neque. Sed eget,10,$71.37,Belgium,15,tellus@outlook.com,Branden Nguyễn,Feugiat Non Lobortis Ltd,Gillian Johnston,Kiara Mccall,Jaime Odom,Orson Ramos,Honorato Lambert,Nasim Blankenship,Kiara Reeves
Leilani Barton,(487) 792-3478,Corse,52624-41335,"Proin nisl sem, consequat nec, mollis vitae, posuere at, velit.",2,$15.03,Canada,9,congue.a.aliquet@yahoo.ca,Deirdre Kha,Pede Incorporated,Kareem Good,Derek Morrow,Yvette Cantu,Xena Conley,Cole Gross,Len Livingston,Vance Buckner
Kiona Christensen,(782) 481-6657,Dunbartonshire,62710-448,"id sapien. Cras dolor dolor, tempus non, lacinia at, iaculis",8,$86.03,Brazil,5,dui.fusce@yahoo.org,Charlotte Nguyễn,Orci Luctus Foundation,William Davenport,Robert Potter,Kirestin Cooley,Doris Watson,Haley Payne,Amos Dominguez,Kasper Glenn
Isabella Goff,(879) 825-1315,Arica y Parinacota,63-642,"lorem lorem, luctus ut, pellentesque eget, dictum placerat, augue. Sed",2,$45.97,Colombia,19,sit.amet@outlook.net,Latifah Nguyễn,In Incorporated,Giselle Levine,Ferdinand May,Juliet Schmidt,Jillian Hunt,Micah Dejesus,Alexis Burgess,Frances Owens
Vincent Martin,(656) 718-3700,Azad Kashmir,839263,"imperdiet ullamcorper. Duis at lacus. Quisque purus sapien, gravida non,",8,$12.28,Canada,5,lorem.ipsum.dolor@hotmail.net,Briar Nguyễn,Urna Inc.,Urielle Mcdonald,Camden Glover,Sean Wooten,Daniel Dodson,Aquila Mckenzie,Cadman Jarvis,Reese Snyder
Dominic Rivers,(621) 143-8265,Aquitaine,856488,"imperdiet, erat nonummy ultricies ornare, elit elit fermentum risus, at",7,$95.94,Costa Rica,11,id@protonmail.org,Fritz Nguyễn,Arcu LLP,Yoshi Rowland,Rajah Ochoa,Ryan Mcbride,Francis Chavez,Clare Buchanan,Damon Franks,Wayne Gibbs
Yetta Peck,1-958-767-7452,Manipur,5097,"ac mi eleifend egestas. Sed pharetra, felis eget varius ultrices,",4,$52.26,Singapore,3,dolor.dapibus@hotmail.ca,Reed Thủy,Ac PC,Bertha Mercer,Roanna Flowers,Jayme Hays,Jane Espinoza,Jael Hensley,James Lee,Ryan Snyder
Octavius Frost,1-417-714-1100,Västra Götalands län,6240,"dolor. Fusce mi lorem, vehicula et, rutrum eu, ultrices sit",4,$58.01,Singapore,15,nec.urna.et@protonmail.couk,Logan Nguyễn,Semper Nam Ltd,Kasper Nixon,Kareem Clayton,Bert Dillard,Jakeem Simon,Zeph Wolfe,Matthew Hurst,Basil Stevenson
Charles Riley,(247) 367-8408,Jharkhand,467669,"urna, nec luctus felis purus ac tellus. Suspendisse sed dolor.",0,$7.28,Pakistan,1,molestie@hotmail.org,Fitzgerald Nguyễn,In Mi Pede LLC,Meghan Walter,Deborah Woodard,Zane Mosley,Elton Rice,Pearl Wise,Kadeem Castillo,Leo Sweet
Mallory Mann,1-875-335-9696,Katsina,30602,et libero. Proin mi. Aliquam gravida mauris ut mi. Duis,4,$60.34,Peru,7,in.faucibus.orci@yahoo.net,Signe Nguyễn,Ligula Aenean LLP,Solomon Salas,Ulysses Rhodes,Addison Finley,Genevieve Wilkins,Phelan Johnson,Yoko Gordon,Daquan Gallegos
