name,phone,region,postalZip,text,numberrange,currency,country,list,email,name1,company,name2,name4,name3,name5,name6,name7,name8
Basil Smith,1-858-731-7486,Bà Rịa–Vũng Tàu,66578,consectetuer euismod est arcu ac orci. Ut semper pretium neque.,2,$58.21,Belgium,7,velit.cras.lorem@yahoo.net,Hayden Nguyễn,Ultrices Corporation,Lael Farrell,Imani Spence,TaShya Jacobs,Lareina French,Xena Barber,Gail Black,Vera Jacobson
Fatima Crane,1-545-589-1385,South Island,58843,"metus urna convallis erat, eget tincidunt dui augue eu tellus.",7,$20.16,India,1,duis@hotmail.org,Aileen Nguyễn,Eu Ultrices PC,Graiden Sandoval,Benjamin Bauer,Berk Miller,Amaya Vincent,Martha Gay,Kitra Chambers,Moana Fuller
Aimee Cardenas,1-214-208-4466,Minas Gerais,36277,"enim. Nunc ut erat. Sed nunc est, mollis non, cursus",1,$10.57,Italy,3,bibendum.fermentum.metus@aol.edu,Dorothy Sử,Cras Inc.,Zeus Bush,Gray Powers,Imani Tyler,Zelda Holden,Honorato Higgins,Wynne Pacheco,Delilah Terrell
Irma Forbes,1-466-370-8402,Banffshire,18014,"interdum. Sed auctor odio a purus. Duis elementum, dui quis",2,$58.81,Spain,11,molestie.tellus@aol.net,Suki Nguyễn,Sit Amet Limited,Brianna Schultz,Wallace O'donnell,Linda Lawson,Kai Kirkland,Chastity Blackburn,Sage Fowler,Ariel Bentley
Rhoda Watkins,1-801-632-1312,Azad Kashmir,6503,tristique aliquet. Phasellus fermentum convallis ligula. Donec luctus aliquet odio.,6,$94.35,South Africa,7,in@outlook.edu,Marah Thiệu,Sit Amet Ornare Institute,Yvette Delacruz,Hilary Pratt,Bevis Fitzpatrick,Alvin Poole,Akeem Rivera,Eleanor Banks,Victor Mckee
Nina Durham,1-124-173-8651,Minas Gerais,37738,"dictum placerat, augue. Sed molestie. Sed id risus quis diam",10,$70.97,Indonesia,15,velit.dui.semper@yahoo.couk,Kiayada Nguyễn,Tellus Phasellus Corp.,Nell Cain,Meredith Schwartz,Judah Simmons,Nasim Hurley,Kareem Townsend,Anne Finch,Dalton Bryant
Keaton Shepherd,1-952-521-8985,Tasmania,35662,"sem. Pellentesque ut ipsum ac mi eleifend egestas. Sed pharetra,",4,$39.45,Germany,15,ridiculus.mus.aenean@google.org,Rigel Thái,Aliquam Ultrices LLP,Quemby Ellis,Orson Cortez,Mona Barnes,Leonard Barron,Lucian Nguyen,Carl Villarreal,Reese Dennis
Ali Sloan,1-674-205-7132,Rajasthan,1374,"velit justo nec ante. Maecenas mi felis, adipiscing fringilla, porttitor",6,$76.04,Mexico,9,dapibus.ligula@yahoo.ca,Deborah Nguyễn,Aenean Inc.,Fredericka Tillman,Sierra Castro,Olivia Jenkins,Kirk Torres,Shad Wall,Winter Osborn,Aladdin Kim
Harlan Cobb,1-647-307-6203,Uttar Pradesh,187282,"sit amet, risus. Donec nibh enim, gravida sit amet, dapibus",2,$79.59,Sweden,7,arcu@outlook.ca,Lael Nguyễn,Semper Tellus Id LLP,Gavin Vargas,Mia Brady,Abra Heath,Beatrice Foley,Mary Pratt,Colorado Ochoa,Ava Oliver
Chloe Mcmillan,(975) 818-7535,Paraná,G9 6PZ,dignissim tempor arcu. Vestibulum ut eros non enim commodo hendrerit.,0,$29.98,France,5,rhoncus@aol.ca,Anastasia Nguyễn,Iaculis Nec Foundation,Tucker Frazier,MacKensie Rivas,Lani Reynolds,Keelie Malone,Rashad Figueroa,Thaddeus Juarez,Fatima Galloway
Ciara Mcguire,1-423-811-2447,North-East Region,A4M 7P2,Vestibulum accumsan neque et nunc. Quisque ornare tortor at risus.,7,$11.19,Philippines,17,suspendisse@protonmail.couk,Sarah Cung,Accumsan Sed LLC,Nita Conner,Yolanda Santiago,Oren Mcclure,Rahim Gray,Lamar Shelton,Alexandra Sellers,Vivien Mejia
Seth Logan,1-886-265-6711,Andhra Pradesh,08780,vitae dolor. Donec fringilla. Donec feugiat metus sit amet ante.,1,$47.87,Indonesia,11,fusce.aliquam@google.couk,Ian Nguyễn,Lectus Associates,Jane Gaines,Macon Hill,Carla Melton,Murphy Terrell,Portia Bennett,Bo Salas,Rajah Moon
Tanek Wells,(642) 283-6486,Viken,7422-3317,"cursus, diam at pretium aliquet, metus urna convallis erat, eget",2,$3.51,Indonesia,17,dictum.mi.ac@aol.net,Simon Chu,Eu Lacus Associates,Yoko Spencer,Nicholas Cain,Bruce Cochran,Signe Richmond,Troy Ayers,Noelani Flores,Lillian Hudson
Knox Sharp,1-566-734-7297,Podlaskie,3240,"pede et risus. Quisque libero lacus, varius et, euismod et,",1,$17.82,Sweden,7,donec.egestas.aliquam@icloud.org,Harper Nguyễn,Adipiscing Associates,Barrett Wiley,Holmes Schwartz,Rafael Soto,Fitzgerald Short,Maris Riley,Leandra Pittman,Noble Rutledge
Lois Barry,1-711-247-1636,Aragón,26814,"ac, eleifend vitae, erat. Vivamus nisi. Mauris nulla. Integer urna.",5,$89.20,Spain,1,orci.lobortis.augue@aol.couk,Murphy Nguyễn,Ullamcorper Nisl Arcu Limited,Rudyard Pollard,Brianna Townsend,Vivian Kemp,Stephen Weber,Slade Paul,Lane Reese,Ethan Rollins
Lesley Briggs,(215) 981-6273,Lombardia,25745,ligula. Aenean euismod mauris eu elit. Nulla facilisi. Sed neque.,8,$33.94,Colombia,3,dis.parturient@protonmail.org,Upton Hồng,Dis Parturient Corporation,India Dean,Nathaniel Hodges,Davis Ochoa,Leilani Keller,Aquila Kinney,Hamish Velasquez,Cyrus Sloan
Rahim Delacruz,(595) 246-2316,Zachodniopomorskie,88812,In at pede. Cras vulputate velit eu sem. Pellentesque ut,9,$81.07,Norway,19,ornare.facilisis@hotmail.edu,Malachi Nguyễn,Ante Nunc Mauris Industries,Rylee Moore,Sylvia Goodman,Davis Beck,Samuel Velazquez,Malachi Cortez,Anthony Watson,Macey Diaz
Tamara Peters,(762) 894-6509,Atlántico,168564,"a ultricies adipiscing, enim mi tempor lorem, eget mollis lectus",7,$33.93,New Zealand,19,aliquet.proin@yahoo.com,Nicole Nguyễn,In Ornare Inc.,Leroy Foster,Madaline Hill,Berk George,Fritz Douglas,Cally Cabrera,Ainsley Hendricks,Zahir Mcclure
Rose Goodman,(474) 714-7611,Styria,173113,interdum ligula eu enim. Etiam imperdiet dictum magna. Ut tincidunt,5,$29.90,Singapore,17,purus.nullam.scelerisque@icloud.ca,Channing Nguyễn,Curabitur Vel Incorporated,Samuel Parker,Mercedes Anthony,Zephania Price,Vincent Carr,Chase Lawson,Neil Stanton,Cain Gray
Helen Banks,1-559-717-2451,North Island,19552,"Proin nisl sem, consequat nec, mollis vitae, posuere at, velit.",5,$36.11,United States,11,massa.non@aol.couk,Kyle Nguyễn,Luctus Ipsum LLP,Nita Gonzales,Lillian Middleton,Freya Manning,Aiko Faulkner,Jillian Houston,Ariana Myers,Aquila Sellers
Imogene Jarvis,1-455-555-7378,Zakarpattia oblast,27366-07921,"tincidunt orci quis lectus. Nullam suscipit, est ac facilisis facilisis,",9,$91.98,Mexico,17,cursus.purus@google.org,Leroy Mẫn,Ipsum Incorporated,Paloma Armstrong,Summer Yates,Thomas Mueller,Teegan Pittman,Carson Russell,Nina Love,Mary Downs
Abel Cleveland,(788) 445-8326,Xīběi,8480,"sem. Pellentesque ut ipsum ac mi eleifend egestas. Sed pharetra,",5,$2.25,Belgium,13,in@yahoo.com,Desiree Lam,Integer Vulputate Risus Incorporated,Inez Simmons,Barry Medina,Moana Grant,Imogene Lindsay,Debra Watkins,Ayanna Terry,Ina Clarke
Colton Walker,(860) 949-8477,Mississippi,46011-66603,convallis dolor. Quisque tincidunt pede ac urna. Ut tincidunt vehicula,3,$51.86,China,15,accumsan.neque@hotmail.couk,Idona Nguyễn,Phasellus At Incorporated,Grady Reese,Miriam Silva,Vincent Guzman,Angela Dillard,Yuli Chan,Yen Cline,Jelani Coleman
Wing Snow,1-803-815-6765,Salzburg,73748,erat vitae risus. Duis a mi fringilla mi lacinia mattis.,1,$66.23,Sweden,11,sit@hotmail.couk,Duncan Nguyễn,Sem Molestie Sodales Inc.,Ella Fernandez,Merritt Cummings,Regina Casey,Dustin Bowen,Kirk Calderon,Heather Cantu,Emma Paul
Nathan Morin,1-843-823-3543,Dōngběi,18689,"urna, nec luctus felis purus ac tellus. Suspendisse sed dolor.",8,$42.39,New Zealand,13,diam.sed.diam@aol.com,Hiram Sử,Lobortis Class Incorporated,Abraham Petty,Erica Justice,Thomas Nunez,Lesley Mathis,Damon Walsh,Kimberley Wyatt,Ruby Rios
Yetta Wooten,(532) 786-6798,KwaZulu-Natal,11366,"iaculis nec, eleifend non, dapibus rutrum, justo. Praesent luctus. Curabitur",9,$7.79,Vietnam,7,placerat@aol.edu,Bree Nguyễn,Elit Pede Malesuada Ltd,Wynne Bradshaw,Jaden Benton,Jeanette Mckinney,Ivan Craft,Odysseus Craft,Elliott Baker,Ira Jones
Oprah Osborn,1-504-182-7822,Viken,3663,"in, dolor. Fusce feugiat. Lorem ipsum dolor sit amet, consectetuer",10,$82.00,Russian Federation,13,mollis.phasellus@yahoo.edu,Fiona Nguyễn,Arcu Vestibulum Inc.,Ignacia Jackson,Karleigh Morse,Declan Terry,Octavius Simmons,Holmes Stewart,Vernon Mills,Jelani Bender
Stacey Cain,(953) 673-7862,Vĩnh Long,47429,"nibh. Aliquam ornare, libero at auctor ullamcorper, nisl arcu iaculis",6,$34.31,China,7,nulla.vulputate@yahoo.edu,Lacey Nguyễn,Arcu Vestibulum Incorporated,Anne Dickerson,Colette Buckley,Daphne Baxter,Kaseem Downs,Howard Sharp,Noel Allison,Margaret Koch
Sylvester Erickson,(657) 850-5182,Azad Kashmir,44567,"fringilla, porttitor vulputate, posuere vulputate, lacus. Cras interdum. Nunc sollicitudin",2,$22.65,Germany,11,accumsan.convallis@outlook.couk,Alec Nguyễn,Tempus Eu Incorporated,Driscoll Franks,Haviva Burks,Lacey Bond,Gretchen Lindsay,Regan Singleton,Ria Cherry,Brandon Campbell
Alfonso Noble,1-208-332-7046,Eastern Visayas,85248,velit. Aliquam nisl. Nulla eu neque pellentesque massa lobortis ultrices.,9,$67.50,Ireland,13,nunc@protonmail.couk,Elijah Nguyễn,Nullam Ut LLC,Ursula Koch,Amity Warren,Emily Rivers,Odette Guy,Lamar Dickson,Shannon Burns,Boris Melton
Keelie Decker,1-355-714-0467,Chiapas,79914,arcu. Morbi sit amet massa. Quisque porttitor eros nec tellus.,3,$96.28,Turkey,19,vel@protonmail.couk,Chiquita Nguyễn,Ornare Placerat Associates,Charissa Trujillo,Indigo Gibbs,Kelly Aguirre,Fulton Alston,Samantha Park,Aaron Lang,Hop Bender
Cooper Vance,(241) 513-7051,Aragón,12906,"ornare, lectus ante dictum mi, ac mattis velit justo nec",4,$15.12,Costa Rica,1,curabitur@protonmail.net,Jelani Nguyễn,In Dolor Corp.,Nerea Torres,Rooney Sosa,Alea Beach,Veronica Bush,Graiden Rogers,Samantha Bush,Cain Lopez
Cade Whitney,(423) 436-7141,Xīnán,4476,Pellentesque tincidunt tempus risus. Donec egestas. Duis ac arcu. Nunc,1,$89.02,Costa Rica,1,in.faucibus.orci@icloud.com,Chloe Tiền,Ac Nulla Ltd,Rosalyn Dodson,James Vincent,Julian Elliott,Nigel Wagner,Adrienne Knapp,Gisela Salazar,Diana Macias
Miranda Bryan,(281) 373-6565,Special Capital Region of Jakarta,64-536,"lacinia orci, consectetuer euismod est arcu ac orci. Ut semper",1,$78.34,Indonesia,11,leo.elementum@protonmail.com,Cadman Nguyễn,Feugiat Institute,Fiona Cochran,Madison Orr,Yeo Mckenzie,Tyler Bird,Graiden Alvarez,Belle Huber,Buffy Avery
Aquila Stewart,(485) 257-8609,Calabarzon,18370-37871,Aliquam fringilla cursus purus. Nullam scelerisque neque sed sem egestas,9,$78.07,New Zealand,1,metus.aliquam@google.org,Ciaran Ngân,Phasellus In Institute,Julian Petersen,Libby Cook,Hu Mosley,Kevyn Adkins,Brittany Green,Nevada Mack,Kirk Baker
Chase Scott,1-323-525-6051,Flevoland,334722,"dui, nec tempus mauris erat eget ipsum. Suspendisse sagittis. Nullam",9,$72.36,Australia,17,ante.blandit@google.ca,Brandon Nguyễn,Mollis Nec Foundation,Keegan Olson,Lacey Craig,Dora Willis,Yoko Davenport,Yoshio Lancaster,Liberty Glover,Alea Reilly
Justin Snow,1-459-336-7131,West Java,16863,"augue scelerisque mollis. Phasellus libero mauris, aliquam eu, accumsan sed,",9,$98.87,Chile,5,rutrum.non.hendrerit@protonmail.org,Nola Thái,Pharetra LLP,Camilla Guzman,Jade Steele,Bevis Spencer,Amethyst Suarez,Odysseus Little,Rhona Hubbard,Tanya Hart
Fredericka Jefferson,(461) 621-7811,Zachodniopomorskie,71-553,"id, mollis nec, cursus a, enim. Suspendisse aliquet, sem ut",6,$81.57,Australia,9,quam.quis@hotmail.couk,Macon Nguyễn,Aenean Gravida Company,Libby Baird,Tanisha Smith,Whoopi Acosta,Ralph Schmidt,Josiah Maddox,Heather Sykes,Myra Riddle
Charity Chen,(663) 883-2492,Murmansk Oblast,389543,eu dui. Cum sociis natoque penatibus et magnis dis parturient,4,$12.69,South Africa,13,viverra.donec@aol.com,Kameko Cảnh,Proin Nisl Institute,Kevyn Roberson,Heidi Glover,Hayes Compton,Cassandra Burton,Kennedy Valentine,Grant Mcclain,Eric Norman
Rhea Gutierrez,(561) 824-8613,Alajuela,23727,"non, lacinia at, iaculis quis, pede. Praesent eu dui. Cum",6,$15.98,Austria,5,lacus@outlook.couk,Xantha Nguyễn,Tortor Nibh Ltd,Gage Pitts,Kieran Irwin,Talon Bass,Kato Merrill,Rama Shannon,Noelani Warren,Ferdinand Merritt
Rae Gonzales,1-242-354-8416,Central Region,78538-38958,"id, ante. Nunc mauris sapien, cursus in, hendrerit consectetuer, cursus",4,$69.22,South Africa,1,lacus.ut.nec@yahoo.org,Dale Nguyễn,Aliquam Rutrum Industries,Emerson Bennett,Jeanette Howe,Warren Hill,Walker Compton,Graiden Berger,Nevada Dunlap,Janna Orr
Benedict Nielsen,1-535-171-6475,Dolnośląskie,17328,"Donec est mauris, rhoncus id, mollis nec, cursus a, enim.",2,$69.19,South Africa,17,nec.cursus@hotmail.ca,Chadwick Kiều,Placerat Orci Inc.,Galena Young,Brenna Beck,Vladimir Rosales,Jesse Davidson,Gay Kinney,Iona Hutchinson,Sharon Taylor
Illiana Burton,(456) 825-7464,KwaZulu-Natal,541368,cubilia Curae Phasellus ornare. Fusce mollis. Duis sit amet diam,6,$55.01,Costa Rica,17,pede.cum@protonmail.ca,Duncan Nguyễn,Nonummy Ipsum Corp.,Aristotle Duke,Fitzgerald Weiss,Macey Kent,Keaton Benson,Aphrodite Cole,Cairo Kemp,Castor Valencia
Raja Benjamin,(807) 398-2483,Kiên Giang,4366-6726,nec urna et arcu imperdiet ullamcorper. Duis at lacus. Quisque,2,$49.26,Sweden,11,facilisi.sed@icloud.couk,Zephr Lệ,Eu Tempor LLP,Knox Scott,Ashton Nicholson,Chase Grant,Barbara Rogers,Heather Carlson,Dolan Dunn,Lucy King
Amela Webb,(623) 427-4857,West-Vlaanderen,394519,"dui. Suspendisse ac metus vitae velit egestas lacinia. Sed congue,",3,$62.13,Italy,15,iaculis.aliquet@hotmail.couk,Karly Nguyễn,Pharetra Ut Industries,Piper Thornton,Kiayada Sandoval,Lucy David,Colton O'donnell,Christopher Baird,Meredith Woods,Steel Solomon
Stephen Santos,(816) 316-2940,Boyacá,92362,"massa. Quisque porttitor eros nec tellus. Nunc lectus pede, ultrices",6,$66.20,Belgium,1,ante@icloud.ca,Sara Nguyễn,Nulla Aliquet Ltd,Ronan Berg,Dominique Holman,Lawrence Fischer,Nasim Baird,Nasim Dickerson,Maxine Stanton,Deanna Jefferson
Macy Pate,(468) 242-2727,North Jeolla,K49 9CE,"gravida non, sollicitudin a, malesuada id, erat. Etiam vestibulum massa",6,$36.97,United Kingdom,13,justo@yahoo.org,Lester Thảo,Arcu LLP,Rahim Mathis,Petra Wolf,Naomi Vazquez,Brock Travis,Ronan Roberts,Graham Guerrero,Yuli Rivers
Wyoming Dominguez,(454) 358-6403,La Libertad,876758,"est, congue a, aliquet vel, vulputate eu, odio. Phasellus at",2,$58.08,New Zealand,17,integer@aol.ca,Noelani Nguyễn,Neque Sed LLP,Gloria Sanford,Abra Alvarado,Aspen Murray,Dennis Dorsey,Thaddeus Buchanan,Ariana Mcfadden,Vielka Downs
Porter Perry,(611) 168-3137,Kyiv oblast,70844,justo eu arcu. Morbi sit amet massa. Quisque porttitor eros,6,$98.55,Austria,15,tempor@icloud.com,Elizabeth Nguyễn,Aliquam Auctor Inc.,Dylan Snow,Francesca Ford,Slade Walsh,Maryam Ellison,Riley Stanton,Aaron Edwards,Kristen Floyd
Megan Hammond,1-233-245-0631,Mexico City,265614,orci luctus et ultrices posuere cubilia Curae Donec tincidunt. Donec,7,$53.26,United Kingdom,15,ullamcorper.duis.cursus@icloud.com,Alan Tân,Cras Corporation,Kylynn Grimes,Julian Reyes,Hayley Rowe,Vernon Vazquez,John Stanley,Bertha Romero,Linda Bennett
Camille Shaffer,1-234-160-4276,Heredia,H1N 5J5,Duis gravida. Praesent eu nulla at sem molestie sodales. Mauris,8,$97.60,Australia,11,semper.rutrum@outlook.org,Cairo Dịch,Malesuada Corp.,Kenyon House,David Puckett,Gil Montgomery,Miranda Barker,Jameson Copeland,Libby Mejia,Latifah Diaz
Jack Mosley,1-645-533-1271,San Andrés y Providencia,Y6Z 7Z4,"in, dolor. Fusce feugiat. Lorem ipsum dolor sit amet, consectetuer",2,$91.17,Norway,5,vitae.posuere.at@hotmail.net,Kyle Nguyễn,Sollicitudin Associates,Iliana Payne,Herman Collier,Allistair Delgado,Aristotle Hunt,Thane Salas,Guy Hurley,Ramona Burch
Zahir Carney,1-611-456-9298,Merionethshire,61807,venenatis lacus. Etiam bibendum fermentum metus. Aenean sed pede nec,4,$51.50,France,17,ultricies.ligula.nullam@hotmail.ca,Remedios Nguyễn,Magnis Dis Corporation,Donovan Knox,Quemby Leach,Ethan Herman,Calista Terrell,Mohammad Hunter,Mariam Hanson,Julie Colon
Calvin Bruce,1-952-863-5392,West Sulawesi,813625,"Nunc sed orci lobortis augue scelerisque mollis. Phasellus libero mauris,",4,$38.35,Indonesia,11,lectus.cum@icloud.ca,Rachel Ôn,Non Feugiat Limited,Lani Norris,Plato Espinoza,Briar Faulkner,Shoshana Gaines,Sara Dodson,Jarrod Mcdaniel,Raphael Boone
Kelly Macdonald,(384) 482-3962,Provence-Alpes-Côte d'Azur,5570,at pede. Cras vulputate velit eu sem. Pellentesque ut ipsum,3,$11.61,South Korea,7,sem.nulla.interdum@outlook.org,Emery Nguyễn,Massa Integer Limited,Fatima Rivera,Grady Bullock,Dennis Smith,Cameron Mckay,Upton Knight,April Prince,Tanek Blackburn
Tiger Butler,(540) 760-2346,Bahia,4650,"pellentesque massa lobortis ultrices. Vivamus rhoncus. Donec est. Nunc ullamcorper,",0,$67.21,United States,17,ligula.aenean@hotmail.com,Vera Nguyễn,Neque Sed LLC,TaShya Dudley,Dacey Frazier,Berk Cooper,Curran Long,Wing French,Kenneth Barnes,Ray Long
Slade Trevino,(897) 763-2332,Kon Tum,D22 4FM,"purus. Duis elementum, dui quis accumsan convallis, ante lectus convallis",0,$89.55,Belgium,11,vitae@aol.net,Arsenio Nguyễn,Libero Morbi Limited,Jasper Whitehead,Wesley Jimenez,Julian Klein,Simone Waller,Melissa Bush,John Logan,Hilel Ortega
Phyllis Ferguson,(174) 518-3548,Sardegna,52205,lacus. Mauris non dui nec urna suscipit nonummy. Fusce fermentum,8,$14.61,Pakistan,1,in.consequat@hotmail.couk,Flynn Nguyễn,Eget Volutpat Ornare Foundation,Liberty Workman,Briar Sheppard,Paki Cohen,Beverly Knowles,Priscilla Barker,Stuart Merrill,Avye Osborn
Hunter Velez,(487) 164-4299,Konya,3148,"consectetuer adipiscing elit. Aliquam auctor, velit eget laoreet posuere, enim",2,$47.42,Ukraine,5,ornare.libero@outlook.net,Bert Nguyễn,Diam Duis Inc.,Celeste Hutchinson,Robin Barlow,Yvette Trujillo,Baxter Cooke,Whilemina Mcneil,Knox Page,Deacon Solomon
Uriah Conner,(350) 614-2628,Trøndelag,136764,dignissim magna a tortor. Nunc commodo auctor velit. Aliquam nisl.,2,$8.93,China,1,ornare.elit@icloud.ca,Akeem Nguyễn,Mauris Inc.,Nayda Moon,Mollie Moody,Kiara Velazquez,Dawn Perkins,Lev Glover,Xanthus Jefferson,Edward Nichols
Jillian Vargas,(267) 798-8824,Southwestern Tagalog Region,69115,"tempus, lorem fringilla ornare placerat, orci lacus vestibulum lorem, sit",3,$86.48,Peru,19,arcu.aliquam.ultrices@protonmail.couk,Rana Nguyễn,Arcu Iaculis Foundation,Demetrius Cain,Libby Duke,Irene Klein,Abdul Harrison,Timon Gaines,Kathleen Gibbs,Imani Ramirez
Emmanuel Reeves,(275) 914-5884,Alberta,78373-57803,"mollis lectus pede et risus. Quisque libero lacus, varius et,",7,$4.58,Brazil,17,vehicula@icloud.ca,Anastasia Nguyễn,Dolor Sit Amet LLP,Emerson Mccoy,Lynn Arnold,Harrison Phillips,Mufutau Schultz,Trevor Cook,Laurel Joyce,Jenette Zamora
Ingrid Freeman,(234) 886-5784,Navarra,S8M 7P2,"dolor sit amet, consectetuer adipiscing elit. Aliquam auctor, velit eget",0,$74.94,Italy,17,integer.tincidunt@aol.edu,Bruno Mã,Arcu Vestibulum Industries,Yuri Slater,Xander Morse,Eaton Keith,Carla Hicks,Lydia Fitzpatrick,Ulla Benton,Serena Short
Meghan Strickland,1-940-171-1668,Mpumalanga,A3W 1C6,arcu. Nunc mauris. Morbi non sapien molestie orci tincidunt adipiscing.,8,$44.21,Colombia,11,mattis.ornare@yahoo.edu,Blaze Thảo,Mauris Sagittis Corporation,Jessamine Wong,Jessamine Lindsey,Calvin Chase,Geoffrey Phelps,Kasper Burns,Garrison Zamora,Xandra Roach
Felix Garrison,(327) 655-4675,Oyo,6394,Duis a mi fringilla mi lacinia mattis. Integer eu lacus.,6,$26.92,France,3,est.mollis@hotmail.org,Len Hà,Aliquam Eu Corporation,Kaitlin Carter,George Allison,Alma Ball,Abdul Lindsay,Mariam Mueller,Reuben Spencer,Beverly Clements
Brianna Levine,1-555-846-7176,Lower Austria,51831,"at, nisi. Cum sociis natoque penatibus et magnis dis parturient",4,$18.15,Poland,1,mauris.eu.turpis@yahoo.ca,Pandora Nguyễn,Donec Elementum Lorem Inc.,Wyoming Harrington,Yuri Dillon,Faith Parks,Levi Mcmillan,Alana Mclaughlin,Rina Lopez,Kyle Glenn
Fuller Skinner,(325) 260-7505,Kocaeli,7542,"a, scelerisque sed, sapien. Nunc pulvinar arcu et pede. Nunc",6,$42.38,Sweden,3,cursus@outlook.com,Farrah Ái,Ut Ipsum Ac Institute,Carly Butler,Mariko Workman,Noble Stone,Oleg Pittman,Cullen Burt,Sydnee Neal,Callie Marshall
Demetria Clements,1-821-144-5535,Ogun,149341,"a ultricies adipiscing, enim mi tempor lorem, eget mollis lectus",4,$68.70,Australia,3,nisi.nibh.lacinia@yahoo.com,Jerome Nguyễn,Fames Ac Incorporated,Xaviera Price,Patricia Butler,Wilma Downs,Farrah Dotson,Jordan Pierce,Jessamine Macdonald,Colin Shannon
Knox Britt,1-656-863-6294,Arkansas,22591,"feugiat. Lorem ipsum dolor sit amet, consectetuer adipiscing elit. Aliquam",9,$39.62,Brazil,3,sed.pharetra.felis@aol.edu,Avram Nguyễn,Mauris Rhoncus Id PC,Hop Silva,Thaddeus Ellison,Bell Wilkinson,Aristotle Shepherd,Deborah Carrillo,Sybill Tucker,Jesse Charles
Amy Henderson,1-536-251-4713,South Chungcheong,956985,"ac mi eleifend egestas. Sed pharetra, felis eget varius ultrices,",3,$74.10,Canada,15,vitae.erat@icloud.org,Merrill Liêu,Gravida Sit Amet Inc.,Linda Good,Hunter Kinney,Kay Carroll,Felix Holcomb,Hammett Benton,Beck Douglas,Gareth Ramos
Octavius Keith,(936) 980-0024,Illes Balears,565746,"blandit viverra. Donec tempus, lorem fringilla ornare placerat, orci lacus",2,$74.07,Singapore,15,consectetuer@yahoo.com,Cairo Cảnh,Mi Industries,Ina Molina,Amanda Medina,Dora Shelton,Thane Weeks,Mira Boone,Amos Houston,Hop Knox
Rylee Simon,(474) 457-5534,Connacht,475364,"lorem lorem, luctus ut, pellentesque eget, dictum placerat, augue. Sed",1,$24.12,China,1,suscipit.est.ac@google.com,Russell Tiết,Ipsum Non Arcu Consulting,Stephen Lucas,Aladdin Park,Heather Guy,Kennedy Mullen,Uma Garrison,Regan Burt,Slade Hoffman
Hayfa Chaney,1-516-743-2722,North Island,28869,"Sed nulla ante, iaculis nec, eleifend non, dapibus rutrum, justo.",2,$17.15,United States,9,pede.ac@google.org,Brandon Nguyễn,Quis Associates,Austin Byrd,Bert Winters,Josiah Houston,Sonia Leonard,Walker Hudson,Paula Stanley,Judith Mcbride
Jonah Bray,1-253-487-1298,Sumy oblast,159388,nec tempus mauris erat eget ipsum. Suspendisse sagittis. Nullam vitae,3,$16.24,Pakistan,19,lacus@aol.ca,Willow Nguyễn,Vel Mauris Incorporated,Hanna Mendez,Jorden Cervantes,Angela Mercado,Kyle Spencer,Teagan Mcneil,Yeo Sharpe,Steven Odom
Preston Bates,(673) 955-0867,Baja California,3225,sollicitudin adipiscing ligula. Aenean gravida nunc sed pede. Cum sociis,8,$11.57,New Zealand,11,nec.enim.nunc@google.net,Adara Nguyễn,Felis Eget Varius Incorporated,Maile Douglas,Logan Durham,Nicholas Rogers,Michelle Warren,Kellie Salinas,Fitzgerald Goodman,Alea Bowman
Lev Sanford,(249) 377-4713,Querétaro,h2C 2N5,"Donec felis orci, adipiscing non, luctus sit amet, faucibus ut,",3,$49.76,Spain,3,consequat.dolor@yahoo.com,Daria Lãnh,Ipsum Incorporated,Lani Macdonald,Ryan Stark,Benjamin Mcdonald,Alexander Brown,Kieran Grant,Aristotle Lang,Emerson Patrick
Ulysses Kelley,1-423-506-8743,Friesland,85553,non nisi. Aenean eget metus. In nec orci. Donec nibh.,6,$53.11,Germany,11,donec.porttitor@protonmail.edu,Griffith Nguyễn,Enim Nunc Ut LLP,Shelby Welch,Wallace Holloway,Ray Justice,Nathan Davenport,Quinlan Parks,Lucy Goodwin,Buffy Marsh
Britanney Acevedo,(715) 486-1383,Distrito Capital,6291,"pharetra, felis eget varius ultrices, mauris ipsum porta elit, a",7,$11.90,South Africa,11,sed.orci.lobortis@hotmail.ca,Gabriel Nguyễn,Ante Ipsum Ltd,Mollie Cooke,Leila Church,Dominic Tillman,Jordan Levine,Elliott Tucker,Jessamine Lara,Audra Browning
Paula Kent,(464) 411-1057,Innlandet,80812,augue. Sed molestie. Sed id risus quis diam luctus lobortis.,1,$50.54,Sweden,9,lorem@icloud.com,Gail Trác,Tristique Pharetra Consulting,Zachary Hawkins,Mason Robles,Suki Valentine,Odette Huber,Clark Thompson,Georgia Boyer,Uriel Kinney
Alexander Stephens,1-797-911-3776,Huádōng,96634,"vel turpis. Aliquam adipiscing lobortis risus. In mi pede, nonummy",10,$59.22,Turkey,13,et@protonmail.ca,Wilma Phí,Cras Interdum LLP,Dominic Wyatt,Barclay Brewer,Brendan Grant,Renee Jacobson,Aiko Zimmerman,Macaulay Ballard,Tiger Mueller
Dominique Valenzuela,1-347-645-4878,Novgorod Oblast,36-36,eu tellus eu augue porttitor interdum. Sed auctor odio a,9,$69.22,France,5,montes.nascetur@outlook.org,Jamalia Nguyễn,Id Enim LLC,Kellie Garrett,Kelly Zamora,Mariko Langley,Odette Weaver,Erasmus Long,Ulysses Durham,Kaitlin Olsen
Phoebe Dyer,1-883-821-8597,Piura,20209,amet ante. Vivamus non lorem vitae odio sagittis semper. Nam,10,$25.12,Netherlands,9,in.consectetuer@protonmail.couk,Lisandra Nguyễn,Mauris Magna Ltd,Wayne Salinas,Guy Gross,Lara Carr,Adrian Oneal,Wanda Gill,Kaseem Nicholson,Patricia Whitaker
Sylvester Preston,(975) 277-6233,Leinster,3848,faucibus. Morbi vehicula. Pellentesque tincidunt tempus risus. Donec egestas. Duis,1,$94.57,Ukraine,7,arcu.vestibulum@aol.org,Hoyt Nguyễn,Mollis Duis Sit Consulting,Portia Mccarthy,Amery Long,Melissa Daugherty,Orson Gibbs,Noelle Stevenson,Echo Mcfadden,Kelsey Terrell
Unity Kirkland,(806) 885-7490,Östergötlands län,3624,"velit egestas lacinia. Sed congue, elit sed consequat auctor, nunc",3,$64.55,United Kingdom,19,varius.nam@icloud.org,Burke Nguyễn,In Condimentum Donec Ltd,Ray Goff,Noble Kerr,Freya Galloway,Neve Hatfield,Tanisha Sims,Aristotle Boone,Echo Cline
Calista Rocha,(188) 584-6059,Saarland,2844 DJ,Vestibulum ut eros non enim commodo hendrerit. Donec porttitor tellus,5,$4.46,Pakistan,3,eu@icloud.com,Christen Mã,Scelerisque Scelerisque Incorporated,Larissa Edwards,Harper Rowe,Cade Burns,Octavius William,Leila Witt,Hayden Chen,Christian Lowery
Hyacinth Tran,(116) 444-6815,Gilgit Baltistan,07833,neque. Sed eget lacus. Mauris non dui nec urna suscipit,5,$91.60,Colombia,3,augue.id.ante@protonmail.ca,Idola Quang,Rutrum Fusce Industries,Gil Drake,Cara Malone,Galvin Smith,Curran Fulton,Anastasia Jacobson,Yen Olsen,Patricia Leblanc
Carolyn Price,(619) 998-0356,Azad Kashmir,6982 IO,tincidunt vehicula risus. Nulla eget metus eu erat semper rutrum.,0,$94.00,Netherlands,1,sed.dictum@outlook.ca,Urielle Nguyễn,Ac Nulla Corporation,Tyler Howe,Brynn Hinton,Hilel Sutton,Reece Clayton,Hanae Lara,Hayley Sloan,Lyle Delgado
Kadeem Schroeder,(288) 641-4188,Piemonte,766836,"aliquet nec, imperdiet nec, leo. Morbi neque tellus, imperdiet non,",2,$63.35,South Africa,17,faucibus@yahoo.net,Lev Xầm,Risus Nunc LLP,Azalia Summers,Kareem Kirby,Ian Doyle,Ivor Buckner,Emerson Brooks,Hoyt Estrada,Katelyn Vance
