name,phone,region,postalZip,text,numberrange,currency,country,list,email,name1,company,name2,name4,name3,name5,name6,name7,name8
Jael Fox,1-114-768-9814,Languedoc-Roussillon,52703,"lacus. Quisque imperdiet, erat nonummy ultricies ornare, elit elit fermentum",3,$38.56,South Korea,19,auctor.odio@hotmail.com,Declan Nguyễn,Ipsum Curabitur Consequat Inc.,Samuel O'donnell,Autumn Ellis,Erin Villarreal,Orson Rich,Chester Hall,Bevis Acevedo,Allistair Hutchinson
Kadeem Barr,(850) 880-8362,Nevada,7210,eget nisi dictum augue malesuada malesuada. Integer id magna et,2,$84.28,Germany,15,vitae.erat@hotmail.com,Ray Thi,Quam Limited,Lila Lloyd,Price Mcdowell,Kareem Russell,Chandler Wooten,Fuller Finley,Zane Maldonado,Anastasia Gregory
Odessa Key,1-781-935-6270,South Sulawesi,204774,"interdum. Sed auctor odio a purus. Duis elementum, dui quis",7,$35.35,Ireland,15,urna@google.edu,Thor Nguyễn,Sed Turpis Corp.,Audrey Hayden,Maile Rhodes,Josephine Cote,Noah Dunn,Grace Hutchinson,Branden Hopper,Kelly Ochoa
Judah Sherman,1-626-261-6737,Renfrewshire,63-97,adipiscing elit. Curabitur sed tortor. Integer aliquam adipiscing lacus. Ut,1,$8.70,Brazil,15,nullam.velit@icloud.edu,Desiree Nguyễn,Tempus Mauris Corporation,Camilla Colon,Vera Pacheco,Gisela Davenport,Pamela Guerra,Meghan Byers,Kimberly Landry,Lee Barnett
Keaton Shields,(286) 524-3981,Cagayan Valley,689860,nulla. Cras eu tellus eu augue porttitor interdum. Sed auctor,1,$90.07,Ireland,1,in.sodales@outlook.ca,Tate Nguyễn,Eu Tellus Eu Institute,Whilemina Maynard,Aline Galloway,Sydnee Knight,Oprah Deleon,Daquan Fuller,Logan Kramer,Fatima Kelly
Macy Bowman,(917) 687-8715,Møre og Romsdal,7169,"aliquet libero. Integer in magna. Phasellus dolor elit, pellentesque a,",7,$45.57,Austria,7,risus@yahoo.ca,Kiayada Dữu,Laoreet Posuere Enim Consulting,Uta Bauer,Bethany George,Francesca Vega,Baker Hyde,Vincent Swanson,Kamal Franks,Elvis Giles
Kenneth Macdonald,1-714-992-3715,South Gyeongsang,25248,"velit in aliquet lobortis, nisi nibh lacinia orci, consectetuer euismod",1,$11.92,Pakistan,5,non.enim@icloud.edu,Tanner Nguyễn,Aenean Eget LLC,Randall Melton,Hedwig Fuentes,Rigel Savage,Nolan Santiago,Echo Cook,Ciaran Sparks,Kirk Wallace
Sonia Conner,(731) 331-7325,Nghệ An,468624,urna. Nunc quis arcu vel quam dignissim pharetra. Nam ac,9,$8.87,India,15,malesuada.fringilla.est@hotmail.com,Aquila Nguyễn,Lorem Donec Institute,Vance Burris,Len Dorsey,Christian Mullen,Tate George,Hollee Britt,Halla Dyer,Alden Massey
Noah Barr,1-846-414-5403,Trentino-Alto Adige,44360-30098,Curabitur massa. Vestibulum accumsan neque et nunc. Quisque ornare tortor,3,$35.35,Philippines,15,augue.scelerisque.mollis@aol.edu,Lucas Nguyễn,Hendrerit Inc.,Coby Kennedy,Xander Allen,Kane Hill,Wallace Ratliff,Xander Carey,Germane Lucas,Boris Carlson
Lani Harrell,1-348-935-6356,Sinaloa,61-887,"sociis natoque penatibus et magnis dis parturient montes, nascetur ridiculus",7,$78.47,Netherlands,15,urna@hotmail.couk,Baxter Nguyễn,Ante Nunc Consulting,Alexa George,Ahmed Collins,Whilemina Munoz,Ethan Lancaster,Jada Hawkins,Dacey Mckay,Yolanda Lowery
Aline Kirby,(451) 455-7649,Nghệ An,2127-9632,"lobortis, nisi nibh lacinia orci, consectetuer euismod est arcu ac",10,$14.04,United Kingdom,11,curabitur.vel@google.ca,Alexa Nguyễn,Tellus Aenean Corp.,Bertha Hewitt,Heidi Harmon,Vivien Morin,Quynn Pate,Talon King,Amethyst Baker,Giacomo Macias
